name1,name2,cat_id
سویشرت پسرانه سوپر میو 22731 - 20072 | Supermino,,5
سویشرت دخترانه فیت نرمال آنجلوس KSP00010948 - 20042 | angelos,,5
زیپ دار سویشرت دخترانه پنگای GRPCM00014167 - 18194 | Pengai,,5
سویشرت پسرانه کوتون اورجینال | 4WKB10406TK,,5
سویشرت دخترانه فول مودا 24KCCK734201921 - 19965 | Fullamoda,,5
سویشرت دخترانه ال سی وایکیکی کیدز W3JO29Z4 - HHY | LCW Kids,,5
هودی کراپ دخترانه طرح قلب,,5
سویشرت آستین بلند ال سی وایکیکی اورجینال | TYCV5O0S8N169756244293069 | LC Waikiki,,5
هودی پسرانه فیت نرمال ال سی وایکیکی کیدز W3CL98Z4 - LAL | LCW Kids,,5
سویشرت آستین بلند کوتون اورجینال | 4WKB10460TK | Koton,,5
سویشرت پسرانه برند جک اند جونز اصل 5002940243,,5
سویشرت دخترانه بریز K17976 - 19966 | Breeze,,5
هودی دخترانه آنجلوس KSP00010949 - 18686 | angelos,,5
هودی بدون کرک کد 5077,,5
سویشرت آستین بلند کوتون اورجینال | 4WKB10319TK | Koton,,5
سویشرت دخترانه برند کوتون اصل 3WKG10491AK,,5
سویشرت آستین بلند کوتون اورجینال | 4WKB10647TK | Koton,,5
سویشرت دخترانه جکندروی 200024 - 17308 | JackandRoy,,5
هودی دخترانه فیت نرمال ال سی وایکیکی کیدز W3HO33Z4 - TXU | LCW Kids,,5
سویشرت پسرانه برند لیمون کمپانی LİMON COMPANY اورجینال 5002920668,,5
سویشرت پسرانه اسلازنگر ST22WC02850 | SLAZENGER,,5
سویشرت دخترانه فیت نرمال کلایمرا کیدز W3IA33Z4 - GP9 | Calimera Kids,,5
سویشرت پسرانه فیت راحت کازابونی CS-23K-007 - 19966 | Casabony,,5
سویشرت پسرانه فیت نرمال السی وایکیکی کیدز W24115Z4NOO | LCW Kids,,5
سویشرت پسرانه – دخترانه برند هومل اصل 921683-9854,,5
سویشرت پسرانه آهنگیم 1-2-10000993 - 19351 | ahengim,,5
سویشرت پسرانه فولامودا اورجینال | 24KCCK890194616,,5
سویشرت پسرانه هاریبو اورجینال | 5003083660,,5
هودی ورزشی پینگ پنگ فشن لاین PngPng 07 | مشکی/سفید,,5
سویشرت پسرانه کوتون ترکیه | 4WMB10311TK,,5
سویشرت دخترانه فول مودا 24KCCK1303195368 - 19965 | Fullamoda,,5
سویشرت آستین بلند کوتون اورجینال | 4WMB10069TK | Koton,,5
سویشرت و هودی کودک / نوجوان یو اس پولو ا u.s. polo assn. | 50253409-VR156,u.s. polo assn. | 50253409-VR156,5
سویشرت دخترانه برند باربی اصل 5002920670,,5
هودی ساده خزدار 4147,,5
سویشرت دخترانه بریز | Breeze,,5
هودی پسرانه زیپ کیدز 1028881 - 19351 | Zepkids,,5
سویشرت دخترانه فولامودا اورجینال | 24MCCK7376197504,,5
سویشرت جک اند جونزی پسرانه Jack & Jones | 12247861,,5
سویشرت آستین بلند کوتون اورجینال | 4WMB10255TK | Koton,,5
سویشرت دخترانه پانچو اورجینال | 2321GK08011,,5
سویشرت دخترانه فیت نرمال آنجلوس KSP00010953 - 20055 | angelos,,5
هودی آریاز پسرانه,,5
سویشرت پسرانه کوتون اورجینال | 4WKB10584TK,,5
سویشرت پسرانه کوتون ترکیه | 4WKB10233TK,,5
هودی دخترانه فیت نرمال میهن W3KD31Z4 - GHX | Myhanne,,5
سویشرت دخترانه پانچو اورجینال | 2321GK08040,,5
سوئیشرت بارونی ستاره,,5
سویشرت پسرانه کوتون ترکیه | 4WKB10210TK,,5
هودی دخترانه به رسم (Behrasm) مدل ماسک اسپایدرمن کد 1108,,5
کت اسپورت دخترانه|پسرانه BABOLAT 1019264,,5
سویشرت کالیفرنیا تو کرکی,,5
سویشرت پسرانه برند کوتون اصل TYC00579896830,,5
سویشرت پسرانه فیت نرمال السی وایکیکی کیدز W3HB95Z4 - JNN | LCW Kids,,5
سویشرت دخترانه بریز K17849 - 19927 | Breeze,,5
سویشرت دخترانه سی ویل گیرلز اورجینال | 19330G22223W1,,5
سویشرت آستین بلند ال سی وایکیکی اورجینال | W35762Z1 - LQB | LC Waikiki,,5
هودی دخترانه پمبه لایف | Pembe Life Kids Club,,5
پولار پسرانه – دخترانه برند دکاتلون اصل 147818,,5
سویشرت پسرانه کلاهدار طوسی سون پون Seven Poon کد B815,,5
سویشرت پسرانه تامی لایف T11EG-11021 - 20072 | TOMMYLIFE,,5
سویشرت آستین بلند ال سی وایکیکی اورجینال | W3HR80Z1 | LC Waikiki,,5
سویشرت دخترانه کانسین مینی اورجینال | GRPCM00017082,,5
سویشرت آستین بلند کوتون اورجینال | 3WMB10018TK | Koton,,5
سویشرت دخترانه برند سی ویل گیرلز اصل 19330G05123W1,,5
هودی سوییشرت چهارخانه پشمی داخل مخمل پسرانه و دخترانه 45 تا 60 4تا12 کد 978495,,5
سویشرت پسرانه فول مودا 24KCCK1303195309 - 19351 | Fullamoda,,5
سویشرت آستین بلند کوتون اورجینال | 4WKB10220TK | Koton,,5
زیپ دار سویشرت دخترانه فول مودا 24KCCK5245201387 - 20045 | Fullamoda,,5
سویشرت دخترانه برند بنتتون اصل 5003071062,,5
سویشرت پسرانه برند New Brand اورجینال 5003008194,,5
هودی کلاهدار پسرانه HOBON کد 357 رنگ دودی,,5
سویشرت آستین بلند کوتون اورجینال | 24KY59000593 | Koton,,5
سویشرت دخترانه فیت نرمال آنجلوس KSP00010938 - 19966 | angelos,,5
سویشرت ال سی وایکیکی اورجینال | W35942Z4 - G6V | LC Waikiki,,5
سویشرت نایکی اورجینال | 9Q0524-023 | Nike,,5
دورس داخل پشمی کد C7051,,5
سویشرت پسرانه برند دیسکاوری اکسپدیشن اصل 5003038444,,5
سویشرت دخترانه گپ اورجینال | 756527,,5
سویشرت پسرانه فول مودا 24MCCK1303194411 - 29666 | Fullamoda,,5
پولار پسرانه برند دکاتلون اصل 331697,,5
سویشرت ال سی وایکیکی اورجینال | W3JO91Z1 - H6Q | LC Waikiki,,5
سویشرت آستین بلند ال سی وایکیکی اورجینال | CHLB64088 | LC Waikiki,,5
سویشرت دخترانه برند سی ویل گیرلز اصل 19330F873K31,,5
هودی بچگانه توکرکی عروسکی,,5
سویشرت دخترانه پمبه لایف GRPCM00017165 - 17878 | Pembe Life Kids Club,,5
سویشرت دخترانه فول مودا 24MCCK1303200692 - 19928 | Fullamoda,,5
سویشرت پسرانه برند آندر آرمور اصل 1357585,,5
سویشرت دخترانه دفاکتو اورجینال | B3100A823AU,,5
سویشرت پسرانه کوتون اورجینال | 3WMB10077TK,,5
سویشرت دخترانه پمبه لایف GRPCM00017190 - 19965 | Pembe Life Kids Club,,5
سویشرت آستین بلند ال سی وایکیکی اورجینال | W3GI00Z4 | LC Waikiki,,5
سویشرت آستین بلند ال سی وایکیکی اورجینال | W3FC77Z1 | LC Waikiki,,5
سویشرت یو اس پلو اورجینال | G083SZ082.000.1259485 | U.S. Polo Assn.,,5
سویشرت دخترانه کالی مرا مودا W3IA34Z4 - GUG | CALİMERA MODA,,5
سویشرت پسرانه AHENGİM | 1-2-10001018,,5
سویشرت پسرانه میهن W3JP65Z4 - GHX | Myhanne,,5
سویشرت پسرانه کوتون اورجینال | 4WKB10407TK,,5
سویشرت دخترانه مدل تاپ میکی,,5
سویشرت دخترانه دفاکتو اورجینال | Y5587A622AU,,5
هودی دخترانه فیت نرمال بنت تون W2IK67Z4JQ4 | BENETTON,,5
سویشرت پسرانه برند ال ام تی دی Lmtd اورجینال 5002931200,,5
سویشرت پسرانه – دخترانه نایک اورجینال | BV6740-463,,5
سویشرت پسرانه – دخترانه لسکن اورجینال | 23NTCS003119,,5
سویشرت پسرانه Quiksilver | EQBWR03213W0,,5
سویشرت دخترانه فول مودا 24KCCK1303195122 - 19351 | Fullamoda,,5
سویشرت پسرانه ال سی وایکیکی کیدز W3BG07Z4 - LAL | LCW Kids,,5
هودی بچگانه فيلا آبي,,5
سویشرت دخترانه فول مودا 24KCCK734200266 - 20600 | Fullamoda,,5
سویشرت پانچو اورجینال | 2321GB08008 | Panço,,5
سویشرت زیپ دار پسرانه ال سی وایکیکی کیدز W35658Z4 - HEU | LCW Kids,,5
سویشرت دخترانه فراکومینا اورجینال | 22FW0FM0287,,5
هودی پسرانه ال سی وایکیکی کیدز W3CC87Z4 - CVL | LCW Kids,,5
سویشرت پسرانه اسکچرز - Skechers SK232065-403,,5
سویشرت دخترانه آنجلوس KSP00010941 - 20042 | angelos,,5
سویشرت دخترانه ال سی وایکیکی کیدز W3IN73Z4 - H1T | LCW Kids,,5
سویشرت دخترانه آنجلوس KSP00010789 - 20600 | angelos,,5
سویشرت پسرانه – دخترانه لسکن اورجینال | 23BTCS003124,,5
هودی پشمی چهارخونه اسپرت,,5
سویشرت پسرانه بریز E19506 - 23710 | Breeze,,5
سویشرت دخترانه فول مودا 24KCCK734200819 - 19351 | Fullamoda,,5
سویشرت دخترانه برند نایک اصل dd5737,,5
سویشرت دخترانه دفاکتو Defacto | Z4755A623SP,,5
زیپ دار سویشرت دخترانه فول مودا 24KCCK1749199269 - 20013 | Fullamoda,,5
سویشرت دخترانه فیت نرمال آنجلوس KSP00010962 - 19413 | angelos,,5
سویشرت پسرانه فول مودا 24KCCK1303195310 - 17234 | Fullamoda,,5
سویشرت پسرانه – دخترانه برند هومل اصل 921713-2001,,5
دورس 01 گاو شاخدار خشمگین,,5
سویشرت یو اس پلو اورجینال | G083SZ082.000.1259357 | U.S. Polo Assn.,,5
هودی بچگانه کریسمس 049 - سایز‌ ۳ ا Children's Christmas hoodie,Children's Christmas hoodie,5
سویشرت آستین بلند کوتون اورجینال | 4WMB10368TK | Koton,,5
هودی دخترانه فیت نرمال السی وایکیکی کیدز W26838Z4 - CVL | LCW Kids,,5
هودی پسرانه ال سی وایکیکی کیدز W3BG56Z4 - CVL | LCW Kids,,5
سویشرت دخترانه فیت نرمال بریز K13774 - 19999 | Breeze,,5
سویشرت دخترانه برند فانکی راکس اصل 5002920638,,5
سویشرت پسرانه فول مودا 24KCCK1303195121 - 20028 | Fullamoda,,5
دورس 206 کوسه وینتیجی,,5
سویشرت پسرانه بریز E16331 - 20074 | Breeze,,5
سویشرت دخترانه آهنگیم 1-2-10001009 - 29666 | ahengim,,5
سویشرت آستین استاندارد دخترانه|پسرانه Slazenger ST22WC031,,5
سویشرت آستین بلند کوتون اورجینال | 3WMB10048TK | Koton,,5
سویشرت پانچو اورجینال | 2321GB08012 | Panço,,5
سویشرت پسرانه فیت نرمال مای سرناد GRPCM00014024 - 19351 | My Serenad,,5
سویشرت پانچو اورجینال | 2221GB08017 | Panço,,5
سویشرت پسرانه برند جک اند جونز اصل 5002940198,,5
سویشرت دخترانه فول مودا 24KCCK1303195393 - 18686 | Fullamoda,,5
سویشرت پسرانه جکندروی 10347 - 20045 | JackandRoy,,5
سویشرت آستین بلند یو اس پلو اورجینال | MUP7568-784-US | U.S. Polo Assn.,,5
هودی نایک زیپدار پسرانه,,5
سویشرت پسرانه پانچو اورجینال | 2321BK08033,,5
سویشرت دخترانه فیت نرمال آنجلوس KSP00010953 - 18686 | angelos,,5
سویشرت و هودی کودک / نوجوان ماوی ا mavi | 6610110-70490,mavi | 6610110-70490,5
سویشرت دخترانه کوتون ترکیه | 3WMG10243AK,,5
سویشرت پسرانه کوتون اورجینال | 4WKB10250TK,,5
سویشرت پسرانه Nike | DJ0063-010,,5
سویشرت دفاکتو اورجینال | B4792A823WN | Defacto,,5
سویشرت پسرانه اسلازنگر ST22WC02950 | SLAZENGER,,5
هودی تک آستین بلند I love my daddy,,5
سویشرت پسرانه سی ویل بویز اورجینال | 19330G03423W1,,5
سویشرت ال سی وایکیکی اورجینال | W3EG07Z1So | LC Waikiki,,5
سویشرت ال سی وایکیکی اورجینال | W39777Z1NS | LC Waikiki,,5
سویشرت دخترانه فیورلا مدل 33514,,5
سویشرت دخترانه بی اند ام اسمایل GRP10023176 - 20028 | Bi&Em Smile,,5
سویشرت دخترانه برند فولامودا اصل 24MCCK1303199695,,5
سویشرت دخترانه گپ اورجینال | 522942,,5
سوییشرت بسته چاپی دخترانه برند VESTIR BIEN کد 1707549147,,5
سویشرت پسرانه تیس اورجینال | 23FW0TJ4420,,5
سویشرت دفاکتو اورجینال | B3050A823WN | Defacto,,5
سویشرت پانچو اورجینال | 2321GB08037 | Panço,,5
سویشرت پسرانه مای سرناد GRPCM00014011 - 18194 | My Serenad,,5
سویشرت نایکی اورجینال | 86K463-001 | Nike,,5
سویشرت پسرانه سی ویل بویز اورجینال | 19973821023W1,,5
هودی دخترانه جی بی جو Jibijo کد 3146,,5
سویشرت و هودی کودک / نوجوان آندر ارمور ا under armour | 363677099,under armour | 363677099,5
سویشرت ال سی وایکیکی اورجینال | W3BM28Z4 | LC Waikiki,,5
سویشرت دخترانه کوتون اورجینال | 4WKG10200AK,,5
سویشرت دخترانه برند بنتتون Benetton اورجینال 5003070983,,5
سویشرت پسرانه فیت نرمال مای سرناد GRPCM00014021 - 21164 | My Serenad,,5
سویشرت دخترانه برند مانگو کیدز اصل 37985927,,5
سویشرت کوتون اورجینال | 24KY59001786 | Koton,,5
سویشرت آستین بلند کوتون اورجینال | 4WMB10408TK | Koton,,5
سویشرت پسرانه فولامودا اورجینال | 24KCCK1303195362,,5
سویشرت ال سی وایکیکی اورجینال | W3HA53Z1 | LC Waikiki,,5
سویشرت دخترانه کراپ کالوریناز | colorinas,,5
سویشرت دخترانه کارترس اورجینال | 2O049810,,5
سویشرت پانچو اورجینال | 2321GB18003 | Panço,,5
سویشرت دخترانه آنجلوس KSP00010938 - 19413 | angelos,,5
سویشرت پسرانه – دخترانه برند هومل اصل 921599-3658,,5
سویشرت پسرانه برند پانچو اصل 2221BK08028,,5
سویشرت پسرانه فیت نرمال ال سی وایکیکی کیدز W3JB09Z4 - GKT | LCW Kids,,5
سویشرت دخترانه برند ال ام تی دی اصل 5002930978,,5
سویشرت طرح دار دخترانه برند پیپرتس کد kids325,,5
سویشرت پسرانه سلفی کیدز GRPCM00016651 - 18194 | Sellfie Kids,,5
سویشرت پسرانه سی ویل بویز اورجینال | 19330G44523W1,,5
سویشرت آستین بلند ال سی وایکیکی اورجینال | W3DH02Z1 | LC Waikiki,,5
سویشرت دخترانه رگولار للا | Lela,,5
سویشرت فانتزی سیلیکونی آستر دار تدی - نارنجی / 50,,5
سویشرت خزدار مردعنکبوتی و فضانوردکد ۲۳۸۶ ا سایز۶/۷/۸/۹ مناسب ۶ سال تا ۱۱سال,سایز۶/۷/۸/۹ مناسب ۶ سال تا ۱۱سال,5
هودی دخترانه,,5
هودی پسرانه فیت نرمال ال سی وایکیکی کیدز W3BG06Z4 - H9S | LCW Kids,,5
سویشرت پسرانه – دخترانه برند لسکن اصل 23NTCS003101,,5
سویشرت دخترانه جکندروی 200038 - 20072 | JackandRoy,,5
سویشرت پسرانه برند کوتون اصل 3WMB10051TK,,5
فروش عمده هودی ژاکارد بچه گانه (2 تا 7سال),,5
سویشرت دخترانه جاسین مینی GRPCM00017039 - 21164 | Cansın Mini,,5
سویشرت دخترانه برند لیمون کمپانی اصل 5002772397,,5
دورس بچگانه کد 21536,,5
سویشرت ال سی وایکیکی اورجینال | W3DM26Z1So | LC Waikiki,,5
سویشرت دخترانه United Colors of Benetton BNT-G20843,,5
زیپ دار سویشرت دخترانه فیت راحت السی وایکیکی کیدز S36575Z4 - F9C | LCW Kids,,5
سویشرت پسرانه السی وایکیکی اکو W29883Z4 - SDG | LCW ECO,,5
هودی پسرانه میهن 23299005445902 - 18194 | Myhanne,,5
سویشرت دخترانه پانچو اورجینال | 2221GK08039,,5
سویشرت پسرانه برند name it name it اورجینال 5002940918,,5
سویشرت پسرانه کازابونی CS-23S-075 - 37290 | Casabony,,5
سویشرت دخترانه برند کوتون اصل 4WKG10574AK,,5
سویشرت پسرانه بنتتون اورجینال | 223A30UNG502N,,5
سویشرت دخترانه کازابونی CS-23S-051 - 20063 | Casabony,,5
سویشرت فلافی با لوگوی مجموعه لوکی,,5
سویشرت کوتون اورجینال | 4WKB10573TK | Koton,,5
سویشرت پسرانه فول مودا 24KCCK734200482 - 20074 | Fullamoda,,5
سویشرت پسرانه برند جک اند جونز Jack & Jones اورجینال 5003072205,,5
سویشرت دخترانه تو خز دار مدل قلبی,,5
سویشرت دخترانه برند فولامودا اصل 24KCCK7564199794,,5
سویشرت آستین بلند ال سی وایکیکی اورجینال | W3HY94Z1 | LC Waikiki,,5
سویشرت دخترانه کوتون Koton | 22k072463c0030,,5
هودی پسرانه میهن W3KJ22Z4 - GHX | Myhanne,,5
سویشرت دخترانه بریز K16378.2 - 19965 | Breeze,,5
سویشرت بچگانه بالنو Baleno کد 8221303B027,,5
هودی تک تو کرکی,,5
سویشرت پسرانه فول مودا 24KCCK1303195362 - 19965 | Fullamoda,,5
هودی تک دخترانه داخل کرک سایز40 و45 کد 1302513,,5
سویشرت پانچو اورجینال | 2321BB08042 | Panço,,5
سویشرت دخترانه سوپر میو 22825 - 20063 | Supermino,,5
سویشرت دخترانه جی بی جو Jibijo کد 3137,,5
سویشرت دخترانه بریز K16936 - 19351 | Breeze,,5
سویشرت پسرانه بنتتون اورجینال | 223A3J68C10G2,,5
سویشرت دخترانه بریز K19157 - 20028 | Breeze,,5
سویشرت دخترانه بریز K17957 - 17878 | Breeze,,5
هودی پسرانه طرح باب و پاتریک کد 1104,,5
هودی پسرانه 27 مدل روباه کد W06 رنگ طوسی,,5
سویشرت و هودی کودک / نوجوان لسکون ا lescon | 321700104,lescon | 321700104,5
هودی دخترانه پنگای GRPCM00014044 - 20042 | Pengai,,5
سویشرت پسرانه برند دفاکتو اصل B8996A823CW,,5
سویشرت پسرانه کانسین مینی اورجینال | GRPCM00014028,,5
سویشرت پسرانه مای سرناد GRPCM00014017 - 20074 | My Serenad,,5
سویشرت پسرانه – دخترانه ناوتیکا اورجینال | VB37022T,,5
سویشرت پسرانه اسلازنگر اورجینال | ST22WC037,,5
سویشرت دخترانه برند داگی اصل 22WG11138BD_BEJ,,5
سویشرت دخترانه برند کوتون اصل 4WKG10527AK,,5
هودی دخترانه پنگای PCM00016444 - 24085 | Pengai,,5
سویشرت دخترانه میهن W3IU58Z4 - CYV | Myhanne,,5
سویشرت دخترانه کالی مرا مودا W3IA32Z4 - FSX | CALİMERA MODA,,5
سویشرت دخترانه فول مودا 24MCCK1303199695 - 20600 | Fullamoda,,5
هودی طرح دار دخترانه نونا Nona کد b0149,,5
سویشرت کوتون اورجینال | TYCZSBHIEN169996913058635 | Koton,,5
سویشرت ال سی وایکیکی اورجینال | W3CL98Z4 - CVL | LC Waikiki,,5
سویشرت پانچو اورجینال | 2221BK08080 | Panço,,5
سویشرت پسرانه برند پانچو اصل 2221BK08079,,5
سویشرت دخترانه برند فانکی راکس Funky Rocks اورجینال 5002920646,,5
سویشرت آستین بلند کوتون اورجینال | TYC00580317424 | Koton,,5
سویشرت دخترانه کوتون اورجینال | 3WKG10515AK,,5
سویشرت پسرانه فیت نرمال کالی مرا مودا W3IP74Z4 - HSF | CALİMERA MODA,,5
سویشرت دخترانه برند کوتون اصل 4WKG10495AK,,5
سویشرت دخترانه برند آروپوستال Aeropostale اورجینال 5002922599,,5
زیپ دار سویشرت پسرانه فیت نرمال ال سی وایکیکی کیدز S46897Z4 - HCE | LCW Kids,,5
سویشرت آستین بلند کوتون اورجینال | TYCWBYZNMN169485918890950 | Koton,,5
سویشرت پسرانه فیت نرمال ال سی وایکیکی کیدز | LCW Kids,,5
هودی ورزشی پینگ پنگ فشن لاین PngPng 35 | مشکی/سفید,,5
دورس اسپرت GAS (303262) - رنگ آبی / سایز60,,5
سویشرت دخترانه گپ اورجینال | 618814,,5
سویشرت دخترانه|پسرانه Napapijri | NP0A4GMS,,5
هودی پسرانه ملورینا Melorina کد 7239,,5
سویشرت دخترانه کالوریناز A17553-SIYAH - 20024 | colorinas,,5
سویشرت زیپ دار دخترانه ال سی وایکیکی کیدز W20899Z4 - HFH | LCW Kids,,5
هودی مشترک دخترانه و پسرانهبرشاد - آبی نفتی - سفید ا bersad bershad | M411-18063,bersad bershad | M411-18063,5
سویشرت دخترانه کوتون Koton کد 4WKG10201AK,,5
سویشرت کوتون اورجینال | KTNEC.00688 | Koton,,5
هودی دخترانه مدل Narnia (قرمز),,5
سویشرت پسرانه بیکمبرگ اورجینال | 22SS0BK0789,,5
سویشرت پسرانه جی بی بی بی اورجینال | 22FW0BG1421,,5
سویشرت دخترانه برند کوتون اصل 3WKG10164AK,,5
سویشرت دخترانه برند کوتون اصل 3WKG10774AK,,5
سویشرت دخترانه فیت نرمال آنجلوس KSP00010940 - 18194 | angelos,,5
سویشرت دخترانه داگی اورجینال | 22WG92006BB_KIR,,5
سویشرت پسرانه برند جی بی بی بی اصل 22PSSBG2401,,5
سویشرت پسرانه ال سی وایکیکی کیدز W1AD55Z4 - J1W | LCW Kids,,5
سویشرت ال سی وایکیکی اورجینال | W36860Z4So | LC Waikiki,,5
سویشرت آستین بلند کوتون اورجینال | 2KMB18070ZK_750_3-6 | Koton,,5
سویشرت آستین بلند کوتون اورجینال | 24KY59000226 | Koton,,5
سویشرت دخترانه موشی | Mushi,,5
سویشرت پسرانه ال سی وایکیکی کیدز W3IC64Z4 - SNE | LCW Kids,,5
سویشرت زیپ دار پسرانه ال سی وایکیکی کیدز W3DA75Z4 - LAK | LCW Kids,,5
هودی جدید خارجی پسرانه | شیک جنس تضمینی و با کیفیت کد 1426,,5
سویشرت یو اس پلو اورجینال | G083SZ082.000.1259530 | U.S. Polo Assn.,,5
سویشرت پسرانه کوتون ترکیه | 4WMB10193TK,,5
هودی دخترانه ال سی وایکیکی LC Waikiki کد W331012Z4,,5
سویشرت پسرانه بریز E1662119966 | Breeze,,5
سویشرت ال سی وایکیکی اورجینال | 9WT437Z1 | LC Waikiki,,5
سویشرت آستین بلند دفاکتو اورجینال | B3383A823WN | Defacto,,5
دورس کراپی کد 1768,,5
هودی دخترانه میهن 23218100015701 - 18686 | Myhanne,,5
سویشرت کوتون اورجینال | 4WKB10593TK | Koton,,5
هودی دخترانه هیژا Hija کد 11333,,5
هودی پسرانه جوتی جینز JootiJeans کد 32073150,,5
سویشرت پسرانه برند بنتتون اصل 5003070982,,5
سویشرت پسرانه کارترس اورجینال | 2O016210,,5
سویشرت و هودی کودک / نوجوان یو اس پولو ا u.s. polo assn. | 50276898-VR019,u.s. polo assn. | 50276898-VR019,5
سویشرت پسرانه اسکیچرز اورجینال | SK232161-013,,5
سویشرت دخترانه سوپر میو 22675 - 20024 | Supermino,,5
سویشرت نایکی اورجینال | EY2B7FELP-HEA | Nike,,5
سویشرت پسرانه بریز E1814323173 | Breeze,,5
سویشرت کوتون اورجینال | 24KY59002196 | Koton,,5
سویشرت پسرانه نیباتی اورجینال | 23PSSNB3401,,5
سویشرت کوتون اورجینال | 8KMG19063OK | Koton,,5
سویشرت پسرانه برند بنتتون Benetton اورجینال 5003071093,,5
سویشرت و هودی کودک / نوجوان آندر ارمور ا under armour | 778667404,under armour | 778667404,5
سویشرت جک اند جونزی پسرانه Jack & Jones | 12152841,,5
زیپ دار سویشرت دخترانه بی اند ام اسمایل GRP10023325 - 20028 | Bi&Em Smile,,5
سویشرت پسرانه فیت راحت السی وایکیکی کیدز W3HU55Z4 - FZ3 | LCW Kids,,5
سویشرت ورزشی دخترانه کریویت مدل moj 24689,,5
هودی دخترانه ستاره کد 5339,,5
سویشرت پسرانه ال سی وایکیکی کیدز W3HE77Z4 - KVX | LCW Kids,,5
هودی پسرانه فیت نرمال السی وایکیکی کیدز W30339Z4LAL | LCW Kids,,5
سویشرت پسرانه فول مودا 24KCCK1303195307 - 19928 | Fullamoda,,5
هودی دخترانه مدل Narnia (قرمز),,5
سویشرت آستین بلند دفاکتو اورجینال | A4585A823AU | Defacto,,5
هودی پسرانه آندر آرمور مدل Boys’ Armour Fleece® Big Logo Hoodie,,5
هودی پسرانه ترک,,5
سویشرت پسرانه برند دفاکتو اصل B2284A823WN,,5
