name1,name2,cat_id
ست گرمکن بلوک رنگی مردانه Puma 677427,,8
ست گرمکن ورزشی مردانه برند ورساچه Versace اورجینال 74GAA3.FS063.G89,,8
ست گرمکن ورزشی مردانه آدیداس اورجینال | 5002994485,,8
مردانه آدیداس اورجینال | IC6769,,8
گرمکن شلوار تمام زیپ منچستریونایتد مشکی 2024 با لوگوهای دوختی و تایلندی,,8
مردانه نایک اورجینال | TK6885-100,,8
ست گرمکن ورزشی مردانه برند اسلازنگر Slazenger اورجینال ST23EE041,,8
ست گرمکن ورزشی مردانه اورجینال | PCPEN7055,,8
ست سویشرت و شلوار ورزشی مردانه نایک مدل DS-2B1311 مشکی,,8
ست گرمکن مردانه Lumberjack | ML MASO 18ITLY135 3FX,,8
سویشرت شلوار نیم زیپ هواداری چلسی Chelsea 2023 Blue,,8
ست سویشرت و شلوار ورزشی مردانه مدل GS-DS-2B1626,,8
ست گرمکن ورزشی یا گرمکن ورزشی طبق تصویر مردانه نایک اورجینال | DC9065,,8
گرمکن شلوار نیم زیپ پاریسن ژرمن 2024 با لوگوهای دوختی و تایلندی,,8
ست گرمکن و شلوار لیورپول (وارداتی) - خیر / L,,8
ست گرمکن ورزشی مردانه اورجینال | PC.7205.SET-G,,8
ست گرمکن شلوار مردانه فوتبال آلشپرت باشگاه گل گهر سیرجان GGS هواداری,,8
ست سویشرت و شلوار ورزشی مردانه کرامپ مدل C-959403,,8
ست گرمکن ورزشی یا گرمکن ورزشی طبق تصویر مردانه نایک اورجینال | DR1681-451-1,,8
ست گرمکن ورزشی مردانه برند پوما Puma اورجینال PMR800Siyah,,8
گرمکن شلوار اسیکس asics navy blue,,8
ست سویشرت و شلوار ورزشی مردانه آلشپرت Uhlsport کد MUH415-001,,8
ست گرمکن ورزشی مردانه اسلازنگر اورجینال | ST22EE021,,8
ست گرمکن ورزشی مردانه برند اصل Pierre Cardin 7045,,8
ست گرمکن مردانه Nike | NK9180-702SARI,,8
ست گرمکن ورزشی مردانه برند مادمکست اصل 5925,,8
ست گرمکن ورزشی مردانه برند NO 601 اورجینال takım1,,8
ست نیم زیپ شلوار پاریسن ژرمن Paris Saint Germain Training 2022-23 White Black,,8
مردانه پوما اورجینال | 84584401,,8
گرمکن شلوار تاتنهام Tottenham Training 2022-23 Black,,8
ست گرمکن و اسلش Nike Pro,,8
ست گرمکن ورزشی یا گرمکن ورزشی طبق تصویر مردانه نایک اورجینال | CW6131-010,,8
ست گرمکن و شلوار ورزشی نایک کد AS1 (سایز L تا 3XL),,8
گرمکن شلوار فرانسه اورجینال 2022,,8
گرمکن شلوار بچه گانه طرح نیوبالانس 4031 NZD,,8
ست گرمکن مردانه Kinetix | TYC00251110282,,8
ست گرمکن مردانه Nike | NK6885-302YEŞİL,,8
ست گرمکن آستین بلند راسته مردانه Buratti | 651003,,8
مردانه پوما اورجینال | 677427,,8
ست گرمکن مردانه Trabzonspor 11E22S008,,8
ست گرمکن ورزشی مردانه هامر جک اورجینال | 5002954393,,8
ست گرمکن ورزشی مردانه برند مادمکست اصل 4679-1,,8
ست گرمکن ورزشی یا گرمکن ورزشی طبق تصویر مردانه نایک اورجینال | DM6843-010-010,,8
سویشرت شلوار نیم زیپ پرسپولیسFc Perspolice TRACK SUIT 1401,,8
ست گرمکن ورزشی مردانه پوما اورجینال | 67597201,,8
ست گرمکن مردانه Reebok TYC00736905715,,8
ست سویشرت و شلوار ورزشی مردانه آلشپرت Uhlsport کد MUH2678-012,,8
ست گرمکن ورزشی مردانه پوما اورجینال | TYCUJ5PP9N168916586375774,,8
گرمکن شلوار مردانه ربوک مشکی قرمز,,8
ست سویشرت شلوار ورزشی مردانه ربوک خط زرد کد 1465118,,8
گرمکن کوهنوردی - L / سبز,,8
ست گرمکن ورزشی یا گرمکن ورزشی طبق تصویر مردانه برند نایک اصل DN4369-0100,,8
گرمکن شلوار نورث فیس Northface,,8
ست سویشرت و شلوار ورزشی مردانه نایک مدل Mub-1178 مشکی,,8
مردانه نایک اورجینال | AST05631,,8
ست گرمکن ورزشی مردانه لاکوست اورجینال | WH9442,,8
گرمکن شلوار نیم زیپ تاتنهام 2023 |مشکی,,8
ست ورزش نایکی سه جیب سبز تیره با شلوار سورمه ای دم پا راسته,,8
ست گرمکن مردانه یو اچ ال اسپورت - uhlsport 12.10.007.002.033.018,,8
پولوشرت و شلوار هواداری استقلال اورجینال Esteghlal poloshirt Original Black With Pants,,8
ست گرمکن آستین بلند مردانه یو اچ ال اسپورت - uhlsport 12.10.007.002.033.012,,8
ست گرمکن ورزشی مردانه برند داینامو Dynamo اورجینال AS-308,,8
ست گرمکن ورزشی مردانه برند استیک Escetic اورجینال 7053,,8
ست گرمکن و شلوار ورزشی مردانه puma مدل CHAMPION IV G-R,,8
گرمکن شلوار پارچه غواصی پورشه - M,,8
ست نیم زیپ و شلوار اتلتیکو مادرید قرمز مشکی ، فلامنت,,8
ست گرمکن ورزشی مردانه میور اورجینال | 001-078003,,8
ست گرمکن شلوار مردانه نخی غواصی ریبوک,,8
ست گرمکن کلوین کلین مردانه Calvin Klein | 000NM2540E,,8
ست سویشرت و شلوار ورزشی مردانه نظری کد 6,,8
ست گرمکن آستین استاندارد راسته مردانه Slazenger | ST13EE006,,8
ست گرمکن شلوار ورزشی مردانه آسیکس غواصی کد 1032713,,8
مردانه آلتین ییلدیز کلاسیک / AC&Co اورجینال | ET9424100001,,8
مردانه نایک اورجینال | dv9753-302,,8
گرم کن شلوار میلنگی ، لباس گرم میلنگی سربازی رنگ طوسی ا Underwear Clothes For Winter,Underwear Clothes For Winter,8
ست گرمکن شلوار ورزشی مردانه نایک طوسی زرد کد 1466190,,8
ست گرمکن ورزشی مردانه برند مادمکست اصل 6359,,8
مردانه گس اورجینال | Z2BQ06FL04Q-P05N,,8
ست گرمکن ورزشی مردانه آدیداس اورجینال | 5002994482,,8
گرمکن شلوار نیم زیپ لیورپول مشکی 2024 با لوگوهای دوختی و تایلندی,,8
ست گرمکن و شلوار چلسی (وارداتی) - خیر / خیر / M,,8
ست گرمکن ورزشی یا گرمکن ورزشی طبق تصویر مردانه برند ترندیول اصل ML GOLD 18ITLY501 3FX,,8
ست گرمکن ورزشی مردانه برند مادمکست اصل 4217,,8
ست نیم زیپ و شلوار ایتالیا سرمه ای آبی،فلامنت,,8
ست سویشرت شلوار ورزشی مردانه آلشپرت اسلش زیپ دار ALA MUH386-103,,8
ست گرمکن ورزشی مردانه اسلازنگر اورجینال | ST21EE060,,8
ست ورزشی گرمکن شلوار طرح نایکی کلاه دار استر داخلی خز مخمل,,8
ست گرمکن آستین استاندارد راسته مردانه Slazenger ST22EE035,,8
ست گرمکن منچستر یونایتد - نیم زیپ شلوار,,8
ست گرمکن فاق نرمال آستین بلند مردانه adidas HR6611-E,,8
ست گرمکن ورزشی مردانه برند bilcee اورجینال TB21ML01S8769-1,,8
ست گرمکن مردانه Trabzonspor 11E22U101,,8
ست گرمکن ورزشی مردانه اسلازنگر Slazenger | ST12EE210,,8
ست گرمکن و شلوار ورزشی مردانه مدل رئال مادرید کد Away 2024,,8
ست گرمکن ورزشی مردانه ترندیول من اورجینال | TMNAW24EM00004,,8
ست گرمکن آستین بلند مردانه Trabzonspor 17E22U101,,8
ست گرمکن ورزشی مردانه آدیداس اورجینال | 5002994512,,8
خرید سویشرت شلوار یوونتوس مشکی,,8
ست گرمکن مردانه Guess | Z2YQ10KB3P2-JBLK,,8
ست نیم زیپ شلوار اینتر میلان Inter Milan Tracksuit 2023-24 Blue Black,,8
ست گرمکن ورزشی مردانه برند استیک Escetic اورجینال CC-A3032,,8
ست گرمکن مردانه Lumberjack | TYC00776217888,,8
ست سویشرت و شلوار ورزشی مردانه مدل 110,,8
گرمکن شلوار تمام زیپ رئال مادرید سرمه ای 2024 با لوگوهای دوختی و تایلندی,,8
ست سویشرت و شلوار ورزشی مردانه مدل بارسلونا 2024RB,,8
ست گرمکن و شلوار منچستر یونایتد (وارداتی) - خیر / خیر / M,,8
ست گرمکن شلوار فراری دم پا راسته,,8
ست گرمکن ورزشی مردانه برند The Champ Clothing اورجینال GLOTKIM5258,,8
ست گرمکن ورزشی یا گرمکن ورزشی طبق تصویر مردانه برند نایک اصل NK3000Gri,,8
ست گرمکن و شلوار ورزشی مردانه پانیل مدل 5024NB,,8
ست گرمکن آستین استاندارد راسته مردانه Slazenger ST13EE003,,8
سویشرت شلوار نیم زیپ هواداری رئال مادرید 2022/2023,,8
ست گرمکن مردانه Lumberjack | M-CT176 LEON TSUIT 3FX,,8
ست گرمکن ورزشی مردانه برند bilcee اورجینال TB23ML01W1524-1,,8
گرمکن شلوار نیم زیپ بارسلونا کرمی مشکی 2024 با لوگوهای دوختی و تایلندی,,8
ست گرمکن ورزشی یا گرمکن ورزشی طبق تصویر مردانه برند ترندیول اصل ML DANTE-CB 25CT1318 3 PR,,8
نیم زیپ شلوار ارسنال Arsenal 2017-18 Training Shirt 14 Zip Red,,8
ست گرمکن مردانه پوما - Puma 620942-02,,8
ست گرمکن مردانه پوما - Puma TYCWH4MWAN169217249559881,,8
مردانه آدیداس اورجینال | GK9656,,8
گرمکن شلوار منچستریونایتد 2023/2024,,8
ست گرمکن مردانه Guess Z2BQ06FL04Q-P9QC,,8
گرمکن شلوار منچستریونایتد 2023/2024,,8
ست گرمکن ورزشی مردانه برند Marco Ferry اورجینال 201165,,8
ست گرمکن ورزشی مردانه آدیداس اورجینال | TX52527B662731,,8
نیم زیپ شلوار چلسی Chelsea Training 2020 Blue,,8
گرمکن شلوار نیم زیپ آرسنال مشکی 2024 با لوگوهای دوختی و تایلندی,,8
ست گرمکن ورزشی یا گرمکن ورزشی طبق تصویر مردانه برند نایک اصل DV ‘ 97 . 53 - 301NDDSPORT,,8
ست نیم زیپ شلوار منچستریونایتد Manchester United Tracksuit 2023-24 Black,,8
ست کاپشن و شلوار ورزشی مردانه crozwise پارچه سانتانا,,8
ست گرمکن ورزشی مردانه فولامودا اورجینال | 24KCCK1726198445,,8
مردانه اسلازنگر اورجینال | ST13EE030,,8
ست گرمکن و شلوار ورزشی مردانه آندر آرمور UNDER ARMOUR,,8
مردانه نایک اورجینال | NKCW6131-010,,8
ست گرمکن ورزشی مردانه برند لامبرجک Lumberjack اورجینال M- ALEX TRACK SUIT 3FX,,8
گرمکن شلوار آث میلان اورجینال 2023,,8
ست گرمکن ورزشی مردانه برند مادمکست اصل 5634,,8
ست گرمکن آستین بلند مردانه پوما - Puma 58584392,,8
ست گرمکن مردانه Kinetix | SN1003 BRUNO FLEX JOGGER,,8
ست گرمکن مردانه Trabzonspor | ts-2324-antrenman-esofman-set-11e23u101,,8
ست گرمکن ورزشی مردانه برند مادمکست اصل 5928,,8
ست گرمکن آستین استاندارد راسته مردانه Slazenger | ST22PE152,,8
سویشرت شلوار مردانه آلشپرت Uhlsport کدMUH2765-001,,8
ست سویشرت و شلوار ورزشی مردانه مدل بارسلونا 2024A,,8
ست گرمکن ورزشی مردانه برند NEED LİFE اورجینال ND 2090,,8
ست ورزشی گرمکن شلوار بارسلونا مردانه,,8
ست گرمکن و شلوار ورزشی مردانه FS کد FS70329,,8
ست گرمکن ورزشی مردانه برند پیرکاردین Pierre Cardin اورجینال TYC00528045325,,8
مردانه بلک اسپاد اورجینال | 70286,,8
ست گرمکن شلوار ورزشی,,8
ست گرمکن ورزشی مردانه برند استیک Escetic اورجینال 7053,,8
ست گرمکن ورزشی یا گرمکن ورزشی طبق تصویر مردانه کینتیکس اورجینال | M-HUNTER REFLECTIVE FULL,,8
ست گرمکن مردانه | نایکی Nike TK6113-677,,8
ست گرمکن ورزشی مردانه برند NEED LİFE اورجینال ND 2245,,8
ست گرمکن بلوک رنگی مردانه پوما - Puma 677427,,8
ست گرمکن مردانه Trabzonspor ts-2324-antrenman-esofman-set-11e23u101,,8
ست گرمکن لیورپول - نیم زیپ شلوار مشکی,,8
ست گرمکن ورزشی یا گرمکن ورزشی طبق تصویر مردانه برند نایک اصل NK6113-463MAVİ,,8
ست گرمکن ورزشی مردانه اسلازنگر اورجینال | ST22PE151,,8
ست تمام زیپ ادیداس منچستر یونایتد ۲۰۲۳ مشکی,,8
ست ورزشی مردانه سویشرت و شلوار گرمکن نایک مشکی,,8
مردانه آدیداس اورجینال | H28922,,8
ست گرمکن شلوار ورزشی مردانه کلاه دار طرح آدیداس تاوا TVA,,8
ست گرمکن ورزشی مردانه برند WAFRA اورجینال EST.0005,,8
ست سویشرت و شلوار ورزشی مردانه نوزده نودیک مدل آیرو ST1919 NB,,8
گرمکن و شلوار ورزشی مردانه نایک کد 284,,8
سویشرت شلوار مردانه آلشپرت Uhlsport کدMUH2765-001,,8
ست گرمکن شلوار ورزشی مردانه آلشپرت اسلش کلاه دار ALA MUH408-006,,8
ست گرمکن مردانه Nike | 040032CW6131_010,,8
گرمکن شلوار آل اشپورت uhlsport,,8
ست گرمکن ورزشی مردانه الیزه اورجینال | M002-GR1,,8
ست سویشرت و شلوار ورزشی مردانه مدل GS-Mub-1178,,8
ست گرمکن ورزشی مردانه پوما اورجینال | 5002996248,,8
سوئیشرت شلوار یوونتوس Juventus training technical tracksuit 2019_20 Black White,,8
مردانه آدیداس اورجینال | IJ6073,,8
سویشرت شلوار ریباک AY1886,,8
مردانه تامی هیلفیگر اورجینال | DM0DM17842.BDS,,8
ست گرمکن ورزشی مردانه برند مادمکست اصل 5673,,8
ست سویشرت و شلوار ورزشی مردانه بالاباز مدل 80211000105 ا Balabazz 80211000105 Sport Sweatshirt And Trousers Set For Men,Balabazz 80211000105 Sport Sweatshirt And Trousers Set For Men,8
ست گرمکن ورزشی مردانه مشکی آدیداس اورجینال | TYC00321082940,,8
ست گرمکن آستین استاندارد راسته مردانه Avva A31Y3345,,8
گرمکن شلوار بارسلونا Barcelona Tracksuit 2023-24 Blue Red,,8
ست گرمکن آستین استاندارد راسته مردانه Slazenger | ST22EE035,,8
مردانه پوما اورجینال | 67596631,,8
ست گرمکن ورزشی یا گرمکن ورزشی طبق تصویر مردانه برند نایک اصل CV3007-100,,8
ست پولوشرت شلوار پاریسن ژرمن (وارداتی) - خیر / L,,8
ست گرمکن مردانه Kinetix | M-HANS TSUIT 3FX,,8
ست گرمکن ورزشی یا گرمکن ورزشی طبق تصویر مردانه برند ترندیول اصل M-SMR BASIC TRACK SUIT 2P,,8
ست کاپشن شلوار ورزشی مردانه نایک کد 347,,8
ست گرمکن ورزشی یا گرمکن ورزشی طبق تصویر مردانه برند نایک اصل NK1710-100Siyah-Byz,,8
ست گرمکن ورزشی مردانه برند پوما Puma اورجینال 24K680000113,,8
ست گرمکن ورزشی یا گرمکن ورزشی طبق تصویر مردانه نایک اورجینال | DM6843-085,,8
ست گرمکن ورزشی مردانه قهوه ای آدیداس اورجینال | FM6312,,8
ست گرمکن ورزشی یا گرمکن ورزشی طبق تصویر مردانه برند ترندیول اصل ML RENATO-CB 18SD1155 3PR,,8
مردانه نایک اورجینال | NK6885-463MAVİ,,8
گرمكن شلوار تيمي 2024,,8
ست گرمکن ورزشی مردانه برند اسلازنگر Slazenger اورجینال ST22EE001,,8
ست گرمکن ورزشی مردانه برند اسلازنگر اصل ST22EE006,,8
پولوشرت شلوار استقلال Esteghlal H0105 Start Poloshirt With Pants Black 1401,,8
ست گرمکن ورزشی مردانه بلک اسپاد اورجینال | 70330,,8
نیم زیپ شلوار آرسنال Arsenal 2019-20 Training Blue Yellow,,8
ست گرمکن ورزشی مردانه برند bilcee اورجینال TB23ML01S0755-1,,8
ست گرمکن ورزشی مردانه برند NEED LİFE اورجینال ND 2245,,8
ست گرمکن ورزشی یا گرمکن ورزشی طبق تصویر مردانه برند نایک اصل CW6131-070,,8
ست گرمکن ورزشی مردانه آدیداس اورجینال | H28922-E,,8
ست گرمکن ورزشی مردانه برند اسلازنگر Slazenger اورجینال ST13EE005,,8
ست گرمکن و شلوار ورزشی مردانه مدل منچستر یونایتد کد 2024W,,8
ست سویشرت و شلوار نیم زیپ پوما مدل دورتموند,,8
گرمکن شلوار چلسی 2023/2024,,8
ست گرمکن ورزشی مردانه برند پیرکاردین Pierre Cardin اورجینال TYC00528045268,,8
ست گرمکن مردانه Guess Z3BQ17KBXE0-FB19,,8
مردانه اسلازنگر اورجینال | ST13EE005,,8
ست گرمکن ورزشی یا گرمکن ورزشی طبق تصویر مردانه برند نایک اصل CV1465-015,,8
ست گرمکن ورزشی مردانه آدیداس اورجینال | IJ6075,,8
سویشرت شلوار ریباک AY1668,,8
ست گرمکن ورزشی مردانه برند اصل PCPEN7055,,8
ست سویشرت و شلوار ورزشی مردانه لیورپول,,8
ست نیم زیپ شلوار رئال مادرید Real Madrid Tracksuit 2023-24 Navy Blue Yellow,,8
ست گرمکن ورزشی مردانه مشکی آدیداس اورجینال | TYC00118914938,,8
ست گرمکن ورزشی مردانه برند مادمکست اصل T5906,,8
ست گرمکن آستین استاندارد راسته مردانه Slazenger ST13EE010,,8
ست گرمکن آستین استاندارد راسته مردانه Slazenger | ST13EE002,,8
ست گرمکن مردانه Nike | TYC00618505082,,8
گرمکن وشلوار استقلال آبی آلشپرت,,8
شلوار گرمکن ورزشی مردانه پوما اورجینال | 58671651,,8
ست گرمکن ورزشی مردانه برند استیک Escetic اورجینال A3078,,8
گرمکن و شلوار مردانه اور شلوار مردانه نایک کد NSMANS850,,8
گرمکن شلوار مردانه باشگاهی پرسپولیس Tracksuits Persepolis,,8
گرمکن شلوار آلشپرت Uhlsport white,,8
ست گرمکن و شلوار لیورپول (وارداتی) - خیر / خیر / M,,8
ست گرمکن و شلوار ورزشی سرمه ای مردانه برند پانیل کد 5024-BL,,8
گرمکن شلوار تمام زیپ بایرن مونیخ 2024 با لوگوهای دوختی و تایلندی,,8
ست گرمکن راسته مردانه adidas 5003047777,,8
گرمکن شلوار آرسنال Arsenal Tracksuit 2023-24 Gray Red,,8
ست گرمکن ورزشی مردانه برند اصل PC-VMM-7BKB,,8
سویشرت شلوار کلاهدار بارسلونا 2023/2024,,8
ست گرمکن مردانه یو اچ ال اسپورت - uhlsport 12.10.007.003.033.005,,8
ست پلار نیم زیپ و شلوار Jack Wolfskin | قرمز,,8
گرمكن شلوار پاريس ژرمن,,8
ست گرمکن آستین استاندارد راسته مردانه Slazenger ST23EE041,,8
ست گرمکن ورزشی مردانه پوما اورجینال | 5003040806,,8
ست گرمکن مردانه | نایکی Nike TK6902,,8
مردانه آدیداس اورجینال | 23Y339IC6772,,8
ست گرمکن ورزشی یا گرمکن ورزشی طبق تصویر مردانه برند نایک اصل nikedh9384070syh,,8
ست گرمکن ورزشی یا گرمکن ورزشی طبق تصویر مردانه برند نایک اصل CW6131-407,,8
ست گرمکن آستین بلند راسته مردانه Lumberjack | ALEX TRACK SUIT 3PR,,8
ست گرمکن آستین استاندارد راه راه مردانه Lescon | 23BTEP001043,,8
ست گرمکن ورزشی مردانه برند مادمکست اصل 5931,,8
ست گرمکن ورزشی مردانه لاکوست اورجینال | WH0874,,8
ست گرمکن آستین بلند مردانه Trabzonspor | 17E22U101,,8
ست گرمکن اینتر میامی - نیم زیپ شلوار,,8
ست گرمکن ورزشی مردانه آدیداس اورجینال | H28916,,8
ست گرمکن مردانه Nike | TK6875-463,,8
مردانه آدیداس اورجینال | GK9950,,8
ست گرمکن ورزشی مردانه برند اونلی اند سانز Only & Sons اورجینال OS22024659,,8
ست گرمکن مردانه Kiğılı | 521068,,8
ست پولوشرت و شلوار رئال مادرید Real Madrid Original Green Polo shirt With Pants 2022,,8
ست گرمکن ورزشی مردانه برند WAFRA اورجینال EST.0005,,8
ست پولوشرت و شلوار بارسلونا Barcelona Original Black Polo shirt With Pants 2022,,8
ست گرمکن ورزشی یا گرمکن ورزشی طبق تصویر مردانه نایک اورجینال | DM6843-407,,8
گرمکن شلوار نیم زیپ یوونتوس 2024 با لوگوهای دوختی و تایلندی,,8
ست گرمکن ورزشی یا گرمکن ورزشی طبق تصویر مردانه نایک اورجینال | NK6885-657KIRMIZI,,8
ست گرمکن مردانه پوما - Puma 845844-73-PP,,8
ست گرمکن ورزشی مردانه برند کالوین کلاین اصل 5002928797,,8
ست گرمکن آستین بلند طرح دار مردانه Nike | DM6843-326,,8
ست ورزشی گرمکن شلوار مردانه نایک,,8
ست گرمکن ورزشی مردانه برند مادمکست اصل 6393,,8
ست گرمکن و شلوار ورزشی مردانه جین 4 عددی کد porsche,,8
ست گرمکن ورزشی مردانه برند Mıknatıs Giyim اورجینال 61,,8
ست گرمکن ورزشی مردانه برند NEED LİFE اورجینال ND 2146,,8
ست گرمکن ورزشی مردانه برند پیرکاردین Pierre Cardin اورجینال P638S5390,,8
ست کاپشن و شلوار ورزشی مردانه مدل Billcee سانتانا اعلا,,8
ست گرمکن ورزشی مردانه آدیداس اورجینال | HZ2220,,8
ست گرمکن مردانه Trabzonspor esofman-takimi-fermuarli-kapsonlu40621,,8
نیم تنه شلوار کلاه دار زیپ دار کد کالا ۶۶۳۹ - بنفش,,8
ست سویشرت و شلوار نیم زیپ پوما مدل منچستر سیتی,,8
ست گرمکن ورزشی یا گرمکن ورزشی طبق تصویر مردانه برند نایک اصل DB1601NIKE,,8
ست بلوز شلوار مردانه فوتبال آدیداس طرح ریال مادرید نیم زیپ AKS,,8
ست گرمکن ورزشی مردانه برند مادمکست اصل 5908,,8
ست گرمکن فاق نرمال آستین استاندارد راسته مردانه Slazenger ST21EE060,,8
ست گرمکن ورزشی مردانه پوما اورجینال | 67742901,,8
ست سویشرت و شلوار ورزشی مردانه تکنیک پلاس 07 مدل GK-SH-121-126-ZO کد 2217728,,8
ست گرمکن کلوین کلین مردانه Calvin Klein | 000NM2510E,,8
مردانه لسکن اورجینال | 23BTEP001048,,8
ست گرمکن مردانه پوما - Puma 532160-01,,8
ست گرمکن ورزشی مردانه اورجینال | PC-VMM-7BKB,,8
ست گرمکن ورزشی مردانه برند باس BOSS اورجینال 50486640.26,,8
ست گرمکن ورزشی زنانه آدیداس اورجینال | GT88022,,8
ست گرمکن ورزشی مردانه برند Cossy By Aqua اورجینال TYC00796420119,,8
مردانه آدیداس اورجینال | TYC1XANUZN169192942788228,,8
ست گرمکن آستین بلند مردانه یو اچ ال اسپورت - uhlsport 12.10.007.002.033.012,,8
ست گرمکن ورزشی مردانه اورجینال | PC-VMM-7BEB,,8
ست گرمکن آستین استاندارد راسته مردانه TRENDYOL MAN | TMNAW24EM00002,,8
گرمکن شلوار مدل آراد,,8
ست گرمکن ورزشی مردانه آدیداس اورجینال | TYC00587110566,,8
ست گرمکن ورزشی مردانه برند پوما Puma اورجینال TYC01IIDRN169271184824828,,8
مردانه نایک اورجینال | NK6885-010SIYAH,,8
ست ورزشی گرمکن شلوار مردانه نایک رنگ مشکی زغالی,,8
ست گرمکن ورزشی یا گرمکن ورزشی طبق تصویر مردانه برند جک اند جونز اصل 12224985,,8
گرمکن شلوار هواداری تاتنهام 2023/2024,,8
ست گرمکن مردانه پوما - Puma PRS1001GRI,,8
