name1,name2,cat_id
OMAX ML03P65I,,2
ساعت مچی عقربه ای زنانه سیکو مدل 9102HS/1,,2
ساعت مچی زنانه گس مدل GW0354L2,,2
ساعت مایکل فلینی با کد2350L-C,,2
ساعت مچی زنانه لوئیجی دی انا LdA مدل KL2291 کد 0S0,,2
ساعت دنیل ولینگتون مدل Iconic Emerald رزگلد - سایز 28 (زنانه) - جعبه چوبی ساده روبان پیچ (رایگان) ا Iconic emerald series - rosegold 28mm,Iconic emerald series - rosegold 28mm,2
ساعت مچی عقربه‌ای مردانه نکسن G3002R18,,2
ساعت مچی مردانه bobo bird کد GD030-2A – راموس شاپ,,2
WATSON W1102G-313,,2
ساعت مچی مردانه الگانس مدل SC8114-706,,2
ساعت مردانه مچی عقربه ای مایکل تامی مدل20261,,2
ساعت مچی مردانه گس کد GW0538G1,,2
ساعت مچی زنانه امپریو آرمانی(EMPORIO ARMANI) مدل AR1443,,2
ساعت مردانه رولکس مدل دیجاست - ROLEX/DATEJUST/90907,,2
ساعت مچی زنانه رویال کرون استیل ROYAL CROWN,,2
ساعت هابلوت مردانه کرنوگراف HUBLOT 582888,,2
ساعت مچی عقربه ای زنانه لاروس مدل 80334-1021,,2
ساعت مچی مردانه جی شاکG-Shock GA-B001G-2A,ساعت مچی مردانه جی شاکG-Shock GA-B001G-2A,2
ساعت مچی عقربه‌ای مردانه مدل G-SH 16122 -M-M,,2
ساعت نایدو هشت ضلعی - سفید,,2
ساعت مچی مردانه تیسوت مدل TISSOT PT-7323,,2
ساعت مچی عقربه ای مردانه واتسون مدل 1059G,,2
ساعت مچی عقربه‌ای مردانه نکسن G3222R1,,2
دیزل DIESEL مدلYF_1109,,2
ساعت مچی مردانه امپاور طرح سون فرایدی,,2
ساعت زنانه رولکس Rolex RLX1310,,2
LEE COOPER LC06391.430,,2
ساعت مچی زنانه EGNIAN مدل PT-7291W,,2
ساعت مچی زنانه بند چرمی comely مدل c-405,,2
ساعت مچی اورینت مدل RA-AC0F07S10B,,2
ساعت مچی زنانه تیلور TYLORمدل TLAL002,,2
ساعت مچی زنانه bobo bird کد GT096-1/2/3A – راموس شاپ,,2
ناوی فورس زنانه کلاسیک ا naviforce 5022,naviforce 5022,2
مچ بند هوشمند شیائومی Mi Band 7 غیر اصل ا Xiaomi Mi Band 7,Xiaomi Mi Band 7,2
ساعت هوشمند مدل m6 ا mi m6,mi m6,2
ساعت زیرو ZIIIRO مدل Solaris Gunmetal Blaze,,2
ساعت لمسی فانتزی - ۱,,2
ساعت مچی عقربه ای زنانه نکسن NE1115L,,2
ساعت مچی زنانه فردریک کنستانت مدل FC-240GRD2NH6B,,2
ساعت مچی مردانه کارن,,2
ساعت کرکره ای عدد یونانی,,2
ساعت مردانه رولکس دیتونا - Rolex/Daytona/6761,,2
ساعت رومانسون مردانه 01,,2
ساعت انزو مدل 834TEG,,2
ساعت دیواری رزین طرح جزیره مدل CH230,,3
ساعت دیواری پازلی طرح سون - مشکی / اقتصادی,,3
ساعت دیواری اربیت - آنتیک گلد(طلایی کهنه) ا orbit,orbit,3
ساعت دیواری فلزی کد 4031 عدد یونانی,,3
ساعت های دکوراتیو اینه نگین گرد رویال - سيلور ا ROYAL,ROYAL,3
ساعت رزین موج طلایی مدلCH232,,3
ساعت دیواری چوبی کد 101,,3
ساعت چوبی C107 - رنگ طبیعی ا C107,C107,3
ساعت دیواری مدرن طرح قطب نما فلزی با موتور تایوانی آرام گرد، رنگ کوره ای، قطر 60 کد H 189,,3
ساعت دیواری چوبی گالری چارگوش مدل cw19 دایره ا CHE WOODEN CLOCK CW19,CHE WOODEN CLOCK CW19,3
ساعت کریستالی طرح مرمر رزینی - مرمر مشکی طلایی / ۳۰,,3
ساعت ایستاده ژوان تک پایه فلزی ا ZHOWAN,ZHOWAN,3
ساعت دیواری ارس کد 7010,,3
"ساعت روستیک دیواری سایز90سانت موتورتایوانی اصل رینگ فلزی رنگ کوره ای ا Rustic wall clock, size 90 cm, original","Rustic wall clock, size 90 cm, original",3
ساعت دیواری سیکو,,3
ساعت دیواری چوبی فلزی مدل منظومه,,3
ساعت دیواری شوبرت مدل - 6436,,3
ساعت دیواری چوبی مدرن مدل لیدی (نقره ای),,3
ساعت دیواری چوبی شوبرت سایز 70 مدل 6171,,3
ساعت دیواری رزینی طرح ساحل,,3
ساعت کیان – چوب گردو – صفحه سفید,,3
ساعت دیواری شلف,,3
ساعت دیواری چوبی گالری چارگوش مدل RC07 مستطیل ا CHE WOODEN CLOCK RC07,CHE WOODEN CLOCK RC07,3
ساعت دیواری مینیمال,,3
ساعت دیواری رزین اپوکسی سفید نقره ای مدل ch242,,3
ساعت دیواری فانتزی,,3
ساعت دیواری ولدر 530,,3
ساعت چوبی بادام 50cm فریم طلایی F693,,3
ساعت دیواری طرح3 کد H 204,,3
ساعت دیواری فانتزی مدل لیدیا (طلایی),,3
ساعت دیواری چوبی مدل آرون,,3
ساعت دیواری رزینی مدل موج نقره کد ch502,,3
ساعت دیواری ملوتیک کد M013,,3
ساعت دیواری رزین سفید نقره ای مدل CH227,,3
ساعت دیواری رزین راه طلایی مدل CH225,,3
ساعت دیواری سانترال m70 سه موتوره ارسال رایگان - سفید,,3
ساعت دیواری ملوتیک کد M054,,3
ساعت دیواری چوبی,,3
ساعت دیواری چوبی مدل مهسا – زمینه نخودی,,3
ساعت شنی هپی تایم قاب مشکی با شنهای رنگی در زمانهای ریزش مختلف,,3
ساعت دیواری گارنت مدل لیماک 5222,,3
ساعت دیواری رزین سفید کرم کریستالی مدل ch238,,3
ساعت دیواری طرح سنگ صدفی,,3
ساعت دیواری چوب زیتون Z595 قطر 60CM,,3
ساعت دیواری روستیک چوب سنجد 50cm کد Z692,,3
ساعت دیواری والتر مدل D4018NE,,3
ساعت دیواری چوبی ا Clock,Clock,3
ساعت دیواری طرح یاقوت رنگ سبز,,3
ساعت دیواری یونانی قطر 60,,3
ساعت دیواری چوبی مدل STERLING,,3
ساعت دیواری والتر مدل K7755,,3
ساعت دیواری چوبی 60CM سنجد F692,,3
ساعت دیواری طرح چوب,,3
ساعت دیواری تینا 211,,3
ساعت چوبی 50cm سنجد F701,,3
ساعت دیواری والتر مدل D4020BR,,3
ساعت چوبی روستیک 50Cm چوب زیتون Z564,,3
ساعت دیواری مدل چرخ دنده,,3
ساعت دیواری چوبی مدل دست ساز کد S-D-001,,3
ساعت ایستاده آرام سری ML36003/A,,3
ساعت تورنتو ۳۰۴ قهوه‌ای,,3
دراور ساعت چوبی لوتوس مدل ALEXANDER کد DC-81 رنگ BR,,3
ساعت دیواری مدل لیا,,3
ساعت چوبی روستیک 60Cm سنجد سیاه F671,,3
ساعت خاتم و مینا آبی مربع,,3
ساعت دیواری رولکس کد 705,,3
ساعت رومیزی Erget-Cb-129,,3
ساعت دیواری لاین آرت,,3
ساعت دیواری فلزی آرام سری MD36003,,3
ساعت دیواری مدرن مدل Compass کد ۶۱۱,,3
ساعت دیواری طرح ساحل,,3
ساعت دیواری,,3
ساعت رومیزی و جاعودی بتنی رویا,,3
ساعت دیواری رزینی طرح نسکافه,,3
ساعت دیواری چوبی تک موتور کد 9911,,3
ساعت رومیزی هرمی سنگ مرمر,,3
ساعت سه بعدی لندن,,3
ساعت دیواری مدرن مدل Big Ben کد ۸۴۴,,3
ساعت دیواری ا Clock,Clock,3
ساعت دیواری با تیکت لندن,,3
ساعت دیواری مدرن مدل Royal plus کد ۶۱۸,,3
ساعت دیواری 5267 Garnet ا garnet clock code 5267,garnet clock code 5267,3
ساعت دیواری مدرن مدل Big ben کد ۶۲۰,,3
لیوان طرح استاد ابتهاج,,3
ساعت دیواری بتنی دو تکه کیان,,3
ساعت دیواری مدرن مدل Gilded gold کد ۸۰۶,,3
ساعت دیواری والتر مدل M8071WW,,3
ساعت دیواری مدل F063,,3
"ساعت خاتم کاری طرح گل ومرغ مدل مربع ا Inlay clock with flower and bird design, square model","Inlay clock with flower and bird design, square model",3
ساعت منبت ورق طلا,,3
ساعت دیواری مارال 21,,3
ساعت دیواری فیروزه ای,,3
ساعت دیواری سال بردز مدل CW-235W,,3
ساعت روستیک مدل SR604,,3
ساعت دیواری مدرن مدل Rubik 2 کد ۸۴۰,,3
ساعت دیواری هانا ۱۰۲ /HANA WALL CLOCK,,3
ساعت دیواری مدل F0330,,3
ساعت دیواری مدرن مدل Paralell کد ۷۱۰,,3
ساعت رومیزی و جاعودی بتنی رز,,3
ساعت رومیزی پایه دار طرح دریا,,3
ساعت دیواری چوبی مدلSR611,,3
ساعت چوبی دیواری F693 چوب زال زالک 60Cm,,3
ساعت دیواری AC-702,,3
ساعت چوبی زیتون 50CM کد Z580,,3
ساعت دیواری حلقه نجات Aboard,,3
ساعت مربع طرح ماه و ماهی,,3
ساعت رومیزی کهکشانی,,3
ساعت چوبی زیتون Z599 قطر 60CM,,3
ساعت دیواری والتر مدل A7021GR,,3
ساعت طرح مرمر,,3
ساعت رومیزی فلزی SAN GABRIEL رنگ سفید,,3
ساعت ارس کد 4031,,3
ساعت دیواری چوبی مدل آیلار,,3
ساعت دیواری والتر مدل C7025BR,,3
ساعت شنی ولنی,,3
ساعت دیواری پس زمینه مینا و قاب خاتم و تذهیب,,3
ساعت دیواری مدرن مدل Nine کد ۷۰۸,,3
ساعت دیواری پرشین کلاسیک,,3
ساعت دیواری مدل F0180,,3
ساعت دیواری والتر مدل A6001BR,,3
ساعت دیواری EC-602,,3
ماگ سرامیکی هدیه روز ولنتاین,,3
ساعت و شمعدان تمام برنز کد 1616,,3
ساعت دفرمه سه تیکه قطر ۶۰,,3
ساعت چوبی روستیک 50cm چوب گردو F182,,3
ست ساعت رومیزی بیتوک BC-002,,3
ساعت خاتم و مینا مربع گل دار,,3
ساعت BIN BOND,,3
ساعت دیواری سالبردز مدل نهنگ و دریا,,3
ساعت دیواری کودک طرح دختر 02,,3
ساعت رزینی و mdf - مشکی طلایی / 25 ا SoorHandiCrafts,SoorHandiCrafts,3
ساعت رومیزی طرح سیب,,3
ساعت دیواری فیروزه‌ای سالبردز مدل CWM-124,,3
قیمت و خرید ساعت دیواری چوبی سایز 57 مدل T0171 - چوبی سرا,,3
ساعت رومیزی فلزی SANTA CLARA کد TC-804 رنگ SILVER,,3
ساعت دیواری,,3
ساعت خورشیدی خاتم مینا نقاشی,,3
ساعت دیواری مدرن مدل Signal کد ۵۰۳,,3
ساعت دیواری برنزی کد 1902,,3
ساعت رومیزی طرح تصویر رهبری مدل اول,,3
ساعت دیواری مستطیل,,3
ساعت تمام خاتم اعلا چهارگوش,,3
ساعت دیواری والتر مدل K7768,,3
ساعت دیواری چوبی مدل RENTON,,3
ساعت دیواری کودک طرح دختر 01,,3
ساعت شنی هپی تایم | Happy Time,,3
ساعت دیواری مدرن مدل Elegance کد ۶۲۹,,3
ساعت روستیک کدSR 603,,3
ساعت دیواری سال بردز طرح ماربل,,3
ساعت دیواری چوبی بزرگ کد 7733,,3
ساعت دیواری بُن,,3
ساعت دیواری سال بردز طرح عدد رنگی,,3
طراحی و ساخت ساعت دیواری برای مشاغل مختلف,,3
ساعت دیواری یونانی قطر 70,,3
ساعت رومیزی Erget-o-115,,3
ساعت دیواری والتر مدل E6034BR,,3
ساعت دیجیتال دیواری آرامش همراه با دماسنج اندازه بزرگ | کد E40,,3
ساعت چوبی رومیزی مدل DEMI کد T-5510 رنگ GRAY(طوسی),,3
ساعت چوبی رزین دار 50CM F706,,3
ساعت دیواری مدل شید ا shid,shid,3
ساعت رومیزی فلزی مدل BELMONT رنگ سفید,,3
ساعت رزینی طرح کریستال و آینه,,3
ساعت شنی هپی تایم | Happy Time,,3
ساعت دیواری مدل F0306,,3
قیمت و خرید ساعت چوبی مثلثی با متن سایز 50 مدل T0169 - چوبی سرا,,3
ساعت دیواری چوبی مدل STANTON کد W-9919,,3
ساعت سه بعدی,,3
ساعت طرح رنگین کمان,,3
ساعت دیواری چوبی کوچک کد 251 سفید,,3
ساعت دیواری مدرن مدل Romance plus کد ۶۰۵,,3
ساعت دیواری فلزی آرام MD6015,,3
ساعت دیواری سال بردز مدل برگ انجیری,,3
ساعت دیواری مدل یونی کورن,,3
ساعت سرسوئیچی (کد421),,3
ساعت دو تیکه روستیک,,3
ساعت مهسا – چوب راش- صفحه سفید,,3
ساعت دیواری مدل سال بردز CW-169,,3
ساعت دیواری والتر مدل B6009NE,,3
ساعت دیواری خورشیدی,,3
ساعت دیواری چرخ دنده ای مدل WELLESLEY کد GC-300307,,3
ساعت شمعدان برنز مدل خروسی فورتیک,,3
ساعت روستیک چوب افرا,,3
ساعت دیواری مدل صدای سخن عشق,,3
ساعت شطرنج لیپ مدل PQ9903A,,3
لیوان سرامیکی ولنتاین طرح گربه,,3
ساعت دیواری ا clock,clock,3
ساعت دختر موفرفری,,3
ساعت رزینی قطر ۶۰ سانت,,3
ساعت خاتم,,3
ساعت دیواری طرح تایر,,3
ساعت دیواری چوبی مدل LEESBURG,,3
ساعت دیواری والتر مدل E6034CR,,3
ساعت دیواری طرح نقشه جهان,,3
ساعت دیواری طرح سیامشق,,3
ساعت دیواری سالبردز مدل دوچرخه CWM-101,,3
ساعت دیواری عددی,,3
ساعت چوبی دیواری F664 قطر 50CM,,3
ساعت دیواری سال بردز مدل قاصدک,,3
ساعت دیواری فلزی آرام MD6010,,3
ساعت ایستاده آرام سری ML36004/A,,3
ساعت دیواری هرمس 1503,,3
ساعت دور طلایی,,3
ساعت چوبي مدل((نازار)),,3
ساعت دیواری چوبی مدل ORVILLE کد WM-19028,,3
ساعت دیواری والتر مدل A6008CR,,3
ساعت دیواری با تیکت تهران,,3
ساعت و شمعدان برنزی کد 05,,3
ساعت دیواری مدل F024,,3
ساعت دیواری مدل الین,,3
ساعت رومیزی مدل چوب و رزین کد 03,,3
ساعت رومیزی آویز ا Blue watch,Blue watch,3
ساعت دیواری رزینی مدل کریستال,,3
ساعت شنی ایکیا ا مدل:EFTERTANKA,مدل:EFTERTANKA,3
ساعت دیواری والتر مدل M8073WGR,,3
ساعت رومیزی زنگ دار طرح دایناسور,,3
ساعت دیواری فلزی آرام MD6016,,3
ساعت دختر و بادکنک,,3
ماگ سرامیکی هدیه روز ولنتاین با طرح بوسه,,3
ساعت دیواری والتر مدل C6031CR,,3
ساعت دیواری مانگ کد 4403,,3
ساعت رومیزی زنگ دار ایکیا رنگ سبز مدل IKEA KUPONG کد 303.587.81 ا IKEA KUPONG Alarm clock code 303.587.81,IKEA KUPONG Alarm clock code 303.587.81,3
ساعت دیواری رزین کد 1015,,3
ساعت دیواری چوبی کیتا، مدل آنتیک، کد CKA 702 – (قطر 60 cm),,3
ساعت دیواری قاب خاتم و تذهیب,,3
ساعت دیواری طلایی جانا کجایی ا 1032,1032,3
ساعت دیواری والتر مدل K7778,,3
ساعت رومیزی فانتزی سفید,,3
ساعت و شمعدان برنزی کد 1611,,3
ساعت دیواری مدرن مدل Zig zag کد ۶۲۵,,3
ماگ سرامیکی هدیه روز ولنتاین متن عاشقانه,,3
ساعت رومیزی زنگ دار بزرگ,,3
ساعت ایستاده دیاکو مدل b10 - طوسی,,3
ساعت دیواری بتنی نیکا,,3
ساعت طرح دریای سیاه بیس ۴۵ سانتی قابل سفارش در ابعاد دلخواه شما,,3
ساعت رومیزی فلزی مدل مکعب,,3
ساعت دیواری طرح کریستال,,3
ساعت طرح چشم نظر,,3
ساعت رومیزی Erget-Tb-128,,3
ساعت دیواری پرشین 101,,3
ساعت دیواری هنری ۵۰۳ / HENRY WALL CLOCK,,3
ساعت دیواری چوبی لوتوس، ساعت دیواری سایز 45، ساعت دیواری کلاسیک با اعداد رومی، ساعت دیواری گرد چوبی نوستالژی طرح دار | کد W 359,,3
BELMONT-B700-GOLD,,3
ساعت رومیزی Artemis,,3
ساعت دیواری مدرن مدل ۳D Romance کد ۸۳۴,,3
ساعت رومیزی چوبی ا Wooden desk clock,Wooden desk clock,3
ساعت دیواری مدل خورشید,,3
ساعت دیواری رزین کد 1022,,3
ساعت روی میزی کد 102,,3
ساعت ویکتور,,3
ساعت دور کرستالی صورتی,,3
ساعت دیواری فلزی آرام سری MD36001,,3
ساعت رومیزی بتنی ا Concrete Desktop Clock,Concrete Desktop Clock,3
استودیو روچی ا Rochi studio,Rochi studio,3
ساعت رو میزی مدل دیجیتال 1_115,,3
ساعت دیواری رزینی طرح دریا و ساحل | کد063,,3
ساعت دیواری چوب زیتون Z598 قطر 60Cm,,3
ساعت دیواری cw646,,3
ساعت برنزی کد 1622,,3
ساعت دیواری تبلیغاتی cb649,,3
ساعت دیواری مدل گرگ,,3
ساعت دیواری AC-604,,3
ساعت رزینی طرح دریا,,3
ساعت چوبی دیواری|طرح سنتی A012,,3
ساعت دیواری مدل پینار,,3
ساعت دیواری رزینی کد 1006,,3
ساعت دیواری والتر مدل E6061BL,,3
ساعت دیواری چوبی کیتا، مدل رویال، کد CKS 643-W - (60 ،40 و 80 cm),,3
ساعت دیواری چوبی زرد آلو,,3
ساعت طرح پروانه,,3
ساعت رومیزی مدل تاس,,3
ساعت رزینی یاسی بفش در قطر ۴۵ قابل سفارش در ابعاد و رنگ دلخواه شما,,3
ساعت دیواری چوبی لوتوس مدل ELMA کد W-8830,,3
ساعت دیواری رزینی طرح پروانه لاوامرا,,3
ساعت دیواری فلزی MD6019 - طلایی ا MD6019 metal wall clock,MD6019 metal wall clock,3
ساعت دیواری رزین کد 1020,,3
ساعت و دماسنج دیجیتالی رومیزی OS-001,,3
ساعت دیواری مدل فرشته کوچک,,3
ساعت دیواری چوبی مدل VICTOR کد WM-19026 رنگ WH/BLACK ا WM-19026-VICTOR-WHITE/BLACK,WM-19026-VICTOR-WHITE/BLACK,3
ساعت دیواری ایکیا مدل PLUTTIS قرمز ا Wall clock,Wall clock,3
ساعت دیواری شوبرت 6770 ا Schobert6770,Schobert6770,3
ساعت و شمعدان برنزی کد 1603,,3
ساعت و شمعدان سنگ و برنز کد 1618,,3
ساعت دیواری کودک طرح فضاپیما,,3
ساعت دیواری رزینی طرح خلیج,,3
لیوان ولنتاین طرح خرگوش و قلب,,3
ساعت دیواری تبلیغاتی cb648,,3
ساعت دیواری چوبی مدل MORITZ,,3
ساعت رو میزی اصل|برند سیکو (seiko)|مدل QXQ028KL ا Seiko Watches Model QXQ028KL,Seiko Watches Model QXQ028KL,3
ساعت دیواری پرشین کارن 2,,3
ساعت دیواری والتر مدل 803w,,3
ساعت دیواری بتنی عدددار صحابی,,3
ساعت رومیزی SA1260 لوسترسازان,,3
ساعت رومیزی مستطیل (کد606),,3
ساعت چوبی لوتوس BEVERLYHILLS-152-CR ا لوتوس,لوتوس,3
ساعت گل برجسته,,3
ساعت دیواری چوبی کیتا، مدل کلاسیک، کد CK 609-C - (قطر 35 cm),,3
ساعت دیواری نقشه جهان با تنوع سایزبندی,,3
ساعت دیواری والتر مدل A6007BR,,3
ساعت دیواری چوبی کیتا، مدل رویال، کد CKS 649-W - (60 ،40 و 80 cm),,3
ساعت رومیزی بتنی,,3
ساعت دیواری بائو باب,,3
ساعت دیواری مدل بلک فور با رنگ مشکی و طراحی زیبا ا Clock Black MDF,Clock Black MDF,3
ساعت دیواری 5308,,3
ساعت دیواری مدرن مدل Moon 2 کد ۸۴۲,,3
ساعت دیواری بتنی دو تکه فوران,,3
ساعت فلزی لوتوس مدل CARLO کد M-20500 رنگ ROSEGOLD,,3
ساعت دیواری چوب و فلز مدل VINELAND رنگ قهوه ای و طلایی,,3
ساعت دیواری سال بردز طرح فرندز / مشکی,,3
ساعت دیواری مدرن مدل Venus کد ۶۰۹,,3
ساعت با طرح دلخواه سه تکه 60 در 60,,3
ساعت دیجیتالی رومیزی اسمارت کلاک,,3
ساعت دیواری چوبی کیتا، مدل رویال، کد CKS 612-W - (60 ،40 و 80 cm),,3
ساعت دیواری مدرن مدل Rubik Plus کد ۸۲۵,,3
ساعت دیواری مرمر ا Clock,Clock,3
ساعت رومیزی ورقه ای,,3
"ساعت مستطیل طرح فیروزه ومینا مدل گل و مرغ ا Rectangular clock with turquoise and enamel design, flower and chicken model","Rectangular clock with turquoise and enamel design, flower and chicken model",3
ساعت رومیزی 5518,,3
ساعت دیواری SS14,,3
ساعت دیواری با رنگ مشکی مدرن دو جنس شیشه نشکن (پلکسی گلس) و چوبی ا black clock,black clock,3
ساعت دیواری چوبی کیتا، مدل رویال، کد CKS 622-W - (60 ،40 و 80 cm),,3
ساعت طرح آنا,,3
ساعت مهسا – چوب گردو – صفحه سفید,,3
ساعت دیواری چوبی کیتا، مدل رویال، کد CKS 647-C - (60 ،40 و 80 cm),,3
ساعت رزینی طرح ماه,,3
ساعت دیواری والتر مدل B6009BR,,3
ساعت دیواری گرد 32 سانتی,,3
ساعت دیواری مدرن مدل Greek کد ۶۰۲,,3
ساعت دیواری چوبی کیتا، مدل رویال، کد CKS 623-C - (60 ،40 و 80 cm),,3
ساعت صفحه لمسی لاکچری WALAR,,3
ساعت دیواری زرد مینیمال ملوتیک کد M085c,,3
ساعت اسلیمی,,3
ساعت خاتم و مینای گوشه دار,,3
ساعت دیواری طرح هزار نقش,,3
ساعت دیواری طرح منظره پاییزی,,3
ساعت دیواری چوبی کیتا، مدل، ویترای، کد CKV 663 T – (قطر 60 cm),,3
ساعت دیواری چوبی کیتا، مدل رویال، کد CKS 602-C - (60 ،40 و 80 cm),,3
ساعت چوب زیتون Z585 قطر 50Cm,,3
ساعت دیواری ا Clock,Clock,3
ساعت دیواری گارنت 5280,,3
ساعت دیواری چوبی طرح رولکس کد 110,,3
ساعت دیواری تهران,,3
ساعت معرق هُم آدیس طرح خوشنويسی خط ثلث چهارقل مدل ترنج کد TJ 039,,3
ساعت رومیزی زنگ دار فانتزی کوچک,,3
ساعت دیواری دارامو مدل D350 نقره ای صفحه مشکی,,3
ساعت,,3
ساعت دیواری comb با طرحی زیبا و مدرن و با تنوع رنگ,,3
ساعت رومیزی آرتمیس مدل 2032 گلد (طلایی) صفحه وایت (سفید),,3
ساعت دیواری بوگاتی B1,,3
ساعت چوبی رومیزی,,3
ساعت دیواری مدل اورانوس چوبی از جنس MDF و در 4 رنگ ا Uranus wall clock,Uranus wall clock,3
ساعت ارس کد 5623,,3
ساعت دیواری والتر مدل C6035CR,,3
ساعت دیواری رزینی طرح رنگین کمان,,3
ساعت دیواری مدرن مدل Moon کد ۶۰۴,,3
ساعت دیواری فلزی آرام MD6014,,3
ساعت دیواری کد 191,,3
ساعت دیواری طرح گل,,3
ساعت دیواری EC-601,,3
ساعت دیواری چوبی لوتوس مدل JASPER کد W-583 ا LOTUS - JASPER Wooden Wall Clock Code W-583,LOTUS - JASPER Wooden Wall Clock Code W-583,3
ساعت و شمعدان برنزی کد 1614,,3
ساعت طرح آترین,,3
ساعت دیواری مدل F0540,,3
ساعت دیواری چوبی کیتا، مدل، ویترای، کد CKV 660 T – (قطر 60 cm),,3
ساعت دیواری طرح کلاسیک - آینه ایی,,3
ساعت دیواری مانگ کد 4402,,3
ساعت چوبی 60CM چوب سنجد کد F690,,3
ساعت دیواری چوبی مدل BEVERLYHILLS رنگ کرم,,3
ساعت دفرمه سه تیکه,,3
ساعت دیواری مدرن مدل Romance 2 کد ۶۳۵,,3
ساعت دیواری آرتمیس مدل 30220 گلد (طلایی),,3
ساعت خرس خوابالو,,3
ساعت دیواری لوکس رزینی,,3
قیمت و خرید ساعت دیواری چوبی سایز 30 مدل T0174 - چوبی سرا,,3
ساعت پایه دار رزین 1003,,3
دراور ساعت چوبی لوتوس مدل ALEXANDER کد DC-81 رنگ WH و BR و BLUE و GRAY ا DC-81-ALEXANDER,DC-81-ALEXANDER,3
ساعت دیواری آرتمیس۲۰۳۵ - سیلور ا Artemis,Artemis,3
ساعت دیواری آرتمیس مدل 2000 سیلور (نقره ای) صفحه سفید,,3
ساعت رومیزی دکوراتیو مدل Polygon کد ۳۰۱D,,3
ساعت و شمعدان برنزی کد 1607,,3
ساعت دیواری آرتمیس مدل 2027 گلد(طلایی) صفحه مشکی,,3
ساعت Fashion qulijia for teen,,3
ساعت معرق هُم آدیس طرح چهار قل مدل ترنج کد TJ 050,,3
ساعت دیواری آرتمیس مدل 2040 طلایی,,3
ساعت دیواری اصل|برند سیکو (seiko)|مدل QXA541KN ا Seiko Watches Model QXA541KN,Seiko Watches Model QXA541KN,3
ساعت رومیزی سیب,,3
ساعت دیواری مدرن مدل Kara کد ۷۰۲,,3
ساعت دیواری رزینی کد 1012,,3
