name1,name2,cat_id
کاپشن کوهنوردی پر سنگین نورث فیس,,0
پالتو خزدار مردانه مارک اصلی,,0
کاپشن مردانه مدل Bako,,0
کاپشن سالامون salomon پارچه گورتکس کره ای اعلا ضد آب و بادگیر,,0
کاپشن‌‌‌ نظامی‌‌‌ آمریکایی‌‌‌ سبز,,0
کاپشن۱۱۲۲,,0
İÇİ KÜRKLÜ KANGURU CEP MONT SU GEÇİRMEZ UNISEX,,0
کاپشن دوپوش ضد آب فورکلاز,,0
کاپشن زمستانی مدل آلفا,,0
نیم پالتو ۶ دکمه,,0
کاپشن ضد آب مردانه سه زیپ پارچه کره‌ای کتان مدل PC,,0
کاپشن کوهنوردی تاکتیکال | کاپشن اصل کوهنوردی | کاپشن کوهنوردی اصل | کاپشن کوهنوردی خارجی اصل | پوشاک خارجی | آمریکایی | اروپایی | عربی | اماراتی | دبی | محصولات پوشاک اصل | محصولات پوشاک اورجینال | کاپشن کوهنوردی اورجینال | کاپشن مردانه,,0
کاپشن پلار مردانه اسنوهاک مدل 9588,,0
کاپشن برزنتی اورجینال برند sologanc - Medium ا Sologanc,Sologanc,0
کاپشن هوشمند شیائومی مدل Temperature Control Jacket ا Xiaomi Ninetygo Smart Heated Down Parka,Xiaomi Ninetygo Smart Heated Down Parka,0
کاپشن سلیکونی مردانه و زنانه جنس به ضمانت علی بابا ، کاپشن پاییزی سلیکونی خوش پوش رنگ بندی و سایز بندی کامل,,0
کاپشن the north face,,0
کاپشن مردانه دورویه,,0
کاپشن کوهنوردی دوپوش؛ با مارک جک لاو JEKELAW مدل: دو پوش پر کد: JKW-622 مردانه,,0
کاپشن مردانه مشکی شمعی198639,,0
کاپشن چریکی آدیداس,,0
بادگیر مشتی نورث فیس ا North Face Fist Windshield Pro-white,North Face Fist Windshield Pro-white,0
کاپشن خارجی ۱۲۲۱,,0
نیم پالتو مردانه,,0
شکت فوتر,,0
کاپشن کار زمستانی (سبز یشمی),,0
کاپشن شلوار مردانه مدل دومان,,0
کاپشن گورتکس کمت لایت میلت | MIV7739 KAMET LIGHT GJM,,0
کاپشن داخل خز,,0
کاپشن طیفی,,0
کاپشن کوهنوردی مردانه کلمبیا مدل OMNI TECH,,0
کاپشن کوهنوردی مردانه نورث فیس مدل HX 208649,,0
کاپشن مردانه مدل AML-241-4604,,0
کاپشن بلند مردانه - مشکی,,0
کاپشن مردانه برند CB Sports,,0
کاپشن کار زمستانی (مشکی),,0
کاپشن تارتان بلند (H98),,0
کاپشن مردانه چرم کروکو مدل لیونارد,,0
کاپشن مردانه کارتال مدا ICC,,0
کاپشن پر مردانه طوسی کد 4566,,0
کاپشن چرم,,0
کاپشن مردانه ساده طوسی تیره مدلAidin,,0
کاپشن جین ترک - آبی / 4xl,,0
پافر,,0
پافر شمعی مردانه G-STAR رنگ طوسی سربی,,0
پالتو فوتر ترک,,0
اورکت خزدار,,0
لباس کاتا آدیداس 12 اونس اصل (adidas kata gi),,0
HORSEFEATHERS CORDON II STORM,,0
کاپشن چرم,,0
بادگیر بلوز شلوار خزدار درجه 1 طرح چرم فری سایز ضدآب ضد باد,,0
HORSEFEATHERS HALEN II INSULATED FLAME RED,,0
کاپشن,,0
کاپشن برشکا,,0
بادگیر بلوز شلوار خزدار کرتکس ژاپن بدون درز درجه 1,,0
پافر,,0
کاپشن ضدآب و ضدباد برند CRIVIT ا Waterproof and windproof jacket CRIVIT,Waterproof and windproof jacket CRIVIT,0
کاپشن شمعی مردانه PHILIPP PLEIN رنگ سرمه ای,,0
کاپشن فرم دو آستر تمام فسفری ستادی اورژانس,,0
پافر مردانه ی دو رو - زرد و مشکی / 3XL,,0
کاپشن زمستانی | پارچه شمعی | رنگ سبز تیره آستر پشم شیشه [ویدئو] کد 30758,,0
کاپشن و بارونی,,0
کاپشن کتان ا Jeep 8642,Jeep 8642,0
کاپشن شمعی مردانه مدل DEFACTO رنگ مشکی,,0
کاپشن میکرو ضد آب نیم تنه یقه خزدار - مشکی / XL,,0
HORSEFEATHERS SPENCER BURGUNDY BLUE MIRAGE,,0
کاپشن مردانه رنگ زرشکی,,0
کاپشن مردانه - L,,0
کاپشن مردانه Fashion,,0
کاپشن مردانه Kiabi,,0
کاپشن خلبانی - شمعی سه لایه / مشکی / M,,0
کاپشن کراپ,,0
کاپشن مردانه طرح چریکی,,0
کاپشن اور,,0
برند میلت ا Millet,Millet,0
پافر,,0
کاپشن مردانه برشکا - مشکی / L,,0
OAKLEY HOLLY ANORAK BLACKOUT,,0
پانجو جا کوله داربرند کمپسور,,0
کاپشن مردانه A003,,0
کاپشن اورجینال THE NORTH FACE,,0
کاپشن شمعی مردانه مدل DEFACTO رنگ طوسی,,0
کاپشن سیلیکونی ضد آب (اصل)یقه طرحدار استین گت دار و انگشتی کار کاملا آستر کشی شده و گرم,,0
کاپشن مردانه کتان - کرمی / L ا Kapshan mardaneh katan,Kapshan mardaneh katan,0
کاپشن مردانه COLINS کد CL1055715,,0
کاپشن مردانه طرح لویی ویتون کد 4285,,0
پالتو پشمی هوگرو مردانه 10436,,0
کاپشن شمعی مردانه PHILIPP PLEIN رنگ سبز یشمی,,0
کاپشن خلبانی چرمی نوبوک یقه خز قهوه ای مردانه نیروی هوایی دری مد,,0
کاپشن دوپوش,,0
پالتو فوتر ترک,,0
کاپشن شمعی مردانه مدل PHILIPP PLEIN رنگ سبز زیتونی درسایزهای XL XXL,,0
پافر زنانه و مردانه 36054,,0
کاپشن پلیسی کمر کش دار,,0
کاپشن مردانه ریباک REEBOK IC9165,,0
کاپشن ضد آب برند نویکا ا Nevica,Nevica,0
کاپشن چرم مردانه مدل Artim ا Artim,Artim,0
کاپشن کتان مردانه,,0
کاپشن شمعی مردانه PHILIPP PLEIN رنگ شتری,,0
کاپشن تمام چرمی ریس برند SPYKE ایتالیا,,0
کاپشن مردانه کتان داخل خز ضخیم برند جیپ سنگشور شده,,0
بادگیر خارجی داخل استر مردانه و پسرانه|رنگ بندی و سایز بندی کامل| فروشگاه سام سنتر - L / سرمه ای سفید,,0
کاپشن مردانه فلیپ بلین ترک - s,,0
تدی مردانه خوزان,,0
کاپشن پاف مردانه فورکلاز – پر – آبی – MT500 -10°C,,0
کاپشن مموری مردانه بادی Kiyan 40317 - XL,,0
بارانی مردانه کچوا- مشکی – زیپ کامل Raincut,,0
کاپشن الیاف مردانه فورکلاز مدل Trek 100 کد 127375,,0
کاپشن وارداتی,,0
کاپشن پوست ماری مردانه رنگ بندی و سایز بندی کامل و شیک |سام سنتر - L / مشکی,,0
بادگیر بلوز شلوار دیجیتالی سبز خزدار درجه 1,,0
کاپشن چرم کنیاک مردانه فورد دری مد,,0
کاپشن اورجینال نیم تنه پلیسی,,0
کاپشن چرم مشکی اسپرت مردانه پاسکال دری مد,,0
کاپشن شمعی مردانه مدل DEFACTO رنگ سرمه ای,,0
کاپشن پر سنگین برند کلمبیا ا Colombia,Colombia,0
کاپشن سلیکونی,,0
HORSEFEATHERS HALEN II INSULATED BLUE MIRAGE,,0
پالتو مردانه مدل ماهوت یقه بلیزر کد TH رنگ سرمه ای,,0
بادگیر اورجینال برند معتبر و استثنای Jeantex آلمان,,0
کاپشن چرم اسلیم فیت اسلیم فیت قهوه ای دورانت مردانه دری مد,,0
کاپشن پر مردانه کرمی روشن کد 4565,,0
پافر دو رو داخل تدی مردانه و پسرانه شیک سایز بندی و رنگ بندی کامل کیفیت بالا |فروشگاه سام سنتر - M / مشکی,,0
کاپشن اورکت آمریکایی جیپ کد C8823,,0
کاپشن و بارونی,,0
کاپشن مردانه C151,,0
کاپشن مردانه پشمه شیشه‌دار - مدل کمرکش,,0
پافر مردانه کد 19562 ا Men's west,Men's west,0
کاپشن بهاره مردانه آندر آرمور مدل UA SPORTSTYLE,,0
کاپشن پافر مردانه - L / مموری,,0
کاپشن مموری مردانه Alma 39603 - XL,,0
کاپشن مردانه آبی مشکی مدل 1384,,0
کاپشن یقه دار مردانه هوگرو 10356,,0
کاپشن مردانه Fila مدل Silva نوک مدادی جنس پارچه مموری 3 لایه دارای یک لایه پشم شیشه سایز L قد کاپشن 75cm,,0
پالتو مردانه مشکی چرم خزدار,,0
تی شرت,,0
پالتو مردانه فوتر دیورسو Diverso,,0
کاپشن جین-آلومینیوم سپاس,,0
کاپشن چرم مردانه سیاه برند derimod 5638115972 ا Siyah Kawhi Erkek Deri Ceket,Siyah Kawhi Erkek Deri Ceket,0
پافر زارا,,0
کاپشن چرم مردانه Chao مدل 2908,,0
کاپشن دو روی پاییزه زمستانه مردانه رنگ مشکی سورمه ای کد 1641,,0
کاپشن پاول اند شارک مردانه - Paul&Shark 12312150,,0
کاپشن پلار قایا(Gaya) مدل آنا,,0
کاپشن۲۶۸۶,,0
کاپشن مردانه مدل Sezar,,0
کاپشن اوری تو خز مارک جیپ با کیفیت خیلی بالا ضد آب | امریکایی | کاپشن اصل | کاپشن خارجی اصل | پوشاک خارجی | آمریکایی | اروپایی | عربی | اماراتی | دبی | محصولات پوشاک اصل | محصولات پوشاک اورجینال | کاپشن اورجینال آمریکایی | کاپشن امریکایی,,0
کاپشن مردانه چرم طبیعی گوسفندی سهندچرم کدk-501,,0
کاپشن دولایه دوپوش مارک نورث فیس North در سه رنگ متفاوت | کاپشن اصل | کاپشن خارجی اصل | پوشاک خارجی | آمریکایی | اروپایی | عربی | اماراتی | دبی | محصولات پوشاک اصل | محصولات پوشاک اورجینال | کاپشن اورجینال | کاپشن شیک | کاپشن پسرانه | هدیه تولد | روز مرد | کادویی | کاپشن مردانه | کاپشن اسپورت | کاپشن مردانه اسپورت | کاپشن کلاهدار,,0
بادگیر لاگوست اسپرت فوق العاده شیک و با کیفیت,,0
کاپشن چرم عسلی تیره مردانه پاییزه زمستانه واکس خور (به همراه واکس مخصوص) کد 1614,,0
پافر چرم داخل خز ببعی مردانه و پسرانه| رنگ‌بندی و سایز بندی کامل شیک| کیفیت بالا |فروشگاه سام سنتر - L / سبز,,0
کاپشن چرم مشکی مردانه مولر دری مد,,0
کاپشن مردانه نیم اور مارک کلمبیا Columbia درجه یک بسیار با کیفیت | کاپشن اسپورت مردانه | کاپشن مردانه پفکی | کاپشن اصل | کاپشن اورجینال | امریکایی | کانادایی | اروپایی | المانی | عربی | اماراتی | کاپشن پفی | کاپشن خارجی اصل | کاپشن مردانه زمستانی | کاپشن پسرانه اصل | کاپشن تاکتیکال و کوهنوردی,,0
کاپشن چرم قهوه ای مردانه Kawhi,,0
پافر مردانه مدل بوفالو کد 8521 رنگ سبز,,0
کاپشن دو رو سایز بزرگ طرح کتان 120127-3,,0
کاپشن,,0
کاپشن راه راه برند Vamos - کیفیت A، رنگ‌های مشکی و سفید - سفید و آبی,,0
کاپشن چرم بلند مشکی مردانه ادرسون دری مد,,0
کاپشن وینداستاپر اسنوهاک کد G210 رنگ نارنجی,,0
کاپشن چرم کلاه دارمردانه رنگ قهوه ای و پشم شیشه دار زمستانه طرح جدید کد 1663,,0
کاپشن چرم . موجود در تمام سایزبندی . رنگبندی:مشکی ،طوسی،شتری,,0
اورکت جیپ کد C21922,,0
کاپشن پر سبک (پر اردک)، مخصوص کوهنوردی، رنگ قرمز نورث فیس,,0
کاپشن و بارونی,,0
کاپشن مردانه دورو بهاره و پاییزه آرپو مدل اروند رنگ مشکی و طوسی تیره,,0
کاپشن زیر مردانه دورو 319421 ا Double men's down jacket 319421,Double men's down jacket 319421,0
کاپشن مردانه مدل امید,,0
کاپشن دوپوش مردانه اسنوهاک,,0
کاپشن الیاف کچوا / FORCLAZ – مدل Trek 100/ سرمه ای,,0
کاپشن کلاهدار مردانه کتان,,0
کاپشن اسکی مردانه برند دکاتلون اصل TYCWI4LWUN170170250831072,,0
کاپشن مردانه Redcher مدل 1642,,0
پالتو مردانه مدل ریچارد کد 2842 وستی شاپ مدل 300530,,0
کاپشن مردانه Loiser مدل 1550,,0
کاپشن مردانه آبتین,,0
کاپشن گلن نیکر با لاینینگ شرپا مردانه از کلمبیا COLUMBIA GLENNAKER SHERPA LINED JACKET MENS,,0
پالتو بارونی مردانه سدرا,,0
پالتو مردانه مدل مخمل جودون یقه بلیزر رنگ قرمز,,0
کت کاپشن چرم سفید داخل تمام خز درجه یک ا White Leather Jacket Coat,White Leather Jacket Coat,0
کاپشن قواره دار ضخیم برزنتی با عایق پشم شیشه رنگ کاراملی شیک,,0
کاپشن شمعی مردانه PHILIPP PLEIN رنگ خاکستری,,0
کاپشن لایکو مهندسی زمستانی,,0
پالتو مردانه مدل سناتور ضد آب کد 005,,0
بادگیر و بارانی نیم زیپ ضدآب کچوا فرانسه (اورجینال),,0
کاپشن مردانه مشکی مدل NASA,,0
Unisex Yağmur Rüzgar Geçirmez Bomber Oversize Mont Ceket Kaban Waterproof,,0
حراج آخر فصل کاپشن مردانه,,0
کاپشن دوپوش مردانه outdoorsport,,0
کاپشن مردانه برند ترندیول اصل ML TOAS 1TOAS01 3PR,,0
کاپشن پَر نورث فیس (فیروزه ایی) مدل APP-206,,0
کاپشن داخل چرم خزدار برند RHONES کد 1703145966,,0
کاپشن زمستانه چرم مردانه رنگ سورمه ای کد 1225,,0
‏كاپشن بهاره و پاييزه کتان کد 6671,,0
کاپشن مردانه قواره دار دورویه اعلاپارچه اعلا سیلیکونی سبز سایزبندی lتا۳xl,,0
کاپشن مردانه برند جک اند جونز اصل TYCJFGML7N169985826957219,,0
پالتو مردانه مدل ماهوت یقه انگلیسی کد TH رنگ مشکی,,0
کاپشن ضد آب مردانه برفی کچوا / ژاکت زمستانی – قهوه ای – SH500 -10°C,,0
پافر مردانه,,0
کاپشن کوهنوردی مردانه کلمبیا مدل OMNI-HEAT,,0
بادگیر مشتی بزمان پرو برند لاریما LARIMO رنگ آبی تیره,,0
کاپشن کار بوفالو (مهندسی),,0
کاپشن کوهنوردی دوپوش نورث فیس کد Dark blue ا Gortex Polar North face Jacket Dark blue,Gortex Polar North face Jacket Dark blue,0
بادگیر بلوز شلوار خزدارجلو باز درجه 1,,0
کاپشن اوری روسی-اروپایی کد 9002,,0
کاپشن مردانه مدل Bako (زرشکی),,0
کاپشن کوهنوردی دوپوش نورث فیس کد Olive ا North Face double-layered climbing jacke Olive,North Face double-layered climbing jacke Olive,0
کاپشن اسپرت نورث فیس کد C2303,,0
کت جین خزدار,,0
کاپشن چرم اسپرت کد C8820,,0
پالتو مردانه مدل ماهوت یقه انگلیسی کد TH رنگ کرم,,0
کاپشن پافر مموری مردانه بدون کلاه,,0
کاپشن دوپوش پلاردار The north face مدل 5588A,,0
کاپشن چرم بلند کلاهدار مشکی مردانه دیاس دری مد,,0
کاپشن شمعی مردانه GANT رنگ خاکستری,,0
کاپشن مردانه برند جک اند جونز اصل 12212233,,0
کاپشن پلار مردانه اسنوهاک کد 7715,,0
پالتو مردانه کیگیلی اورجینال | 466367,,0
کاپشن پافر شمعی مردانه اسپرت کارن (7 رنگ),,0
کاپشن مردانه برند جک اند جونز اصل 5003051888,,0
کاپشن مردانه کلاهدار اورجینال - 2 / 2 / 2,,0
کاپشن مردانه اورکت جیپ JEEP سفارشی (AMERICAN) سنگشور شده و بسیار با کیفیت | کاپشن اسپورت مردانه | کاپشن مردانه پفکی | کاپشن اصل | کاپشن اورجینال | امریکایی | کانادایی | اروپایی | المانی | عربی | اماراتی | کاپشن پفی | کاپشن خارجی اصل | کاپشن مردانه زمستانی | کاپشن جیپ,,0
کاپشن اصل مردانه خارجی المنت دار (هیتر دار) گرمکن از طریق پاوربانک | کاپشن اسپورت مردانه | کاپشن مردانه پفکی | کاپشن اصل | کاپشن اورجینال | امریکایی | کانادایی | اروپایی | المانی | عربی | اماراتی | کاپشن پفی | کاپشن المنتی اصل | کاپشن المنتدار اورجینال | کاپشن مردانه زمستانی | هدیه روز مرد | هدیه تولد | هدیه روز پدر,,0
اورکت آمریکایی آلفا,,0
کاپشن چرم سفید زیپ کج مردانه مدل gfj655 ا Men's White Zipper Leather Jacket,Men's White Zipper Leather Jacket,0
کاپشن چرم مشکی مردانه مولر,,0
کاپشن مردانه A836,,0
کاپشن مردانه ساده مشکی مدلAidin,,0
کاپشن مردانه Slazenger | TYCWW37DKN169237830907706,,0
لباس بارانی و بادگیر,,0
کاپشن مردانه نایک اورجینال | TYC00664634072,,0
کاپشن چرم طبیعی مردانه کد cs1101,,0
کاپشن مردانه چرم مدل DERIK ا ME,ME,0
کاپشن برزنتی نوک مدادی ضخیم تمام خز شیک و جدید,,0
اورکت مردانه,,0
کاپشن هیتردار کد C9618,,0
کاپشن مردانه برند اسکیچرز اصل S222069-001,,0
کاپشن بادگیر مردانه آلشپرت کلاه دار ALA MUH2850-103 | سفید/طوسی,,0
کاپشن مردانه برند جک اند جونز اصل 12238877-Orange,,0
کاپشن مردانه Bof Honey مدل 2950,,0
بارانی ضد آب دولایه پولو سرمه ای کد 130446,,0
کاپشن گرم زمستانه مشکی مردانه کلاه دار و داخل خزکد 1594,,0
کاپشن دوپوش مردانه اسنوهاک کد 218888A,,0
کاپشن خلبانی کلاهدار,,0
‏كاپشن مردانه پاييزه خلباني MIXBRAND‏ ‏,,0
کاپشن مردانه جک اند جونز اورجینال | 12241790,,0
۴۰۰۷۱ کاپشن مموری مردانه بادی Nike,,0
کاپشن لی خزدار دودی 118021-6,,0
کاپشن مردانه ماوی اورجینال | 110135,,0
بارونی دو رو مشکی فسفری CAT مدل 1382,,0
کاپشن مردانه هوگرو 10172,,0
بارانی و بادگیر ورزشی مردانه برند میزانو اصل J2GEA50260,,0
کاپشن چرم تمام خز زیپ‌کج فوق العاده جذاب و جدید ۱۴۰۲ ا Fur Leather Jacket,Fur Leather Jacket,0
کاپشن چرم مردانه سرمه‌ای کد 17174 ا men's leather jacket code 17174,men's leather jacket code 17174,0
کاپشن مردانه برند جک اند جونز اصل 12238561,,0
کاپشن مردانه برند لافت اصل LF2027666_Q1.V1,,0
کاپشن مردانه مدل DIOP,,0
کاپشن چرم بوفالو کد 5992,,0
کاپشن چرم مردانه مدل SERGIO,,0
کاپشن مردانه برند ماوی اصل 110197,,0
کاپشن پر اسپورت کد 5591,,0
کاپشن مردانه برند ماوی اصل 110267,,0
کاپشن مردانه ال سی وایکیکی مدل W2BK24Z8,,0
کاپشن مردانه نایک اورجینال | DM1794-325,,0
کاپشن مردانه بهاره و پاییزه آرپو مدل سهند رنگ مشکی,,0
اورکت الفا آمریکایی | اورکت امریکایی | اورکت اصل | اورکت خارجی اصل | پوشاک خارجی | آمریکایی | اروپایی | عربی | اماراتی | دبی | محصولات پوشاک اصل | اورکت کاپشن آمریکایی,,0
کاپشن پازلی سفید,,0
کاپشن چرم قرمز زیپ کج اسپرت,,0
بادگیر مردانه HAKAN مدل 2724,,0
پافر مشکی مردانه برشکا - L,,0
پالتو مردانه مدل ماهوت یقه انگلیسی کد TH رنگ شتری,,0
کاپشن مردانه برند نایک اصل DD6857-010,,0
کاپشن ضد آب شیائومی Xiaomi (اورجینال اصلی ارسال فوری),,0
کاپشن فرم آبی فسفری دو آستر,,0
کاپشن مردانه برند جک اند جونز اصل 12238720,,0
کاپشن بهاره مردانه ال سی وایکیکی مدل S10652Z8,,0
کاپشن کتان مردانه چریکی Araz 40650 - L,,0
کاپشن مموری مردانه بادی Kiyan 40081,,0
کاپشن مردانه Slazenger | TYCS0MLNUN169237816877008,,0
کاپشن پر لایت مردانه اسنوهاک کد SN-C2123,,0
کاپشن پاول اند شارک آستین بلند هندسی مردانه Paul&Shark | 12312004A,,0
کاپشن مردانه جک اند جونز اورجینال | 12238849,,0
کاپشن موتور سواری مردانه Harley Davidson TXCEA328C215248,,0
کاپشن مردانه برند جک اند جونز اصل 12211978,,0
کاپشن پوست ماری,,0
کاپشن مردانه دکاتلون اورجینال | 8560941,,0
پالتو فوتر مشکی کد 129374,,0
بارانی مردانه زاگرس Zagros کد 14820014,,0
کاپشن مردانه آدیداس اورجینال | 5003082159,,0
کاپشن مردانه لی کوپر اورجینال | 231 LCM 232010,,0
کاپشن لی کلاهدار رنگ کرم - اورجینال دیلم ا Cream Colored Lily Jacket,Cream Colored Lily Jacket,0
کاپشن مردانه بادی دورو 41133-Zima - طوسی،شیری / 2XL,,0
بارونی دو رو سورمه ای لیمویی CAT مدل 1381,,0
کاپشن مردانه لافت اورجینال | 2030168,,0
کاپشن و بارونی,,0
کاپشن مردانه مدل Viper,,0
پالتو مردانه مدل فوتر یقه انگلیسی رنگ مشکی وستی شاپ مدل 300532,,0
کاپشن پر سایز بزرگ خارجی مردانه,,0
کاپشن چرم مشکی مردانه لاپورت,,0
کاپشن مردانه برند جک اند جونز اصل 12238978,,0
کاپشن اعلا برزنتی,,0
پالتو مردانه مدل آرکا انگلیسی کد TH401 رنگ کرم,,0
کاپشن مردانه اسلازنگر ا slazenger | ST22JE060-500,slazenger | ST22JE060-500,0
کاپشن بادی مردانه بوراتی 5761080 B - 19351 | Buratti,,0
کاپشن الیاف انیسه مدل تِرِکینگ 150,,0
کاپشن پر مردانه نایکی مدل KP-200,,0
شکت مردونه چشمی گلیمی REVER ISLAND,,0
کاپشن جک اند جونز مردانه - Jack & Jones 12237726,,0
کاپشن شلوار فرهنگ,,0
کاپشن یقه دار پشت یقه چاپ دار آستین فینگ دار,,0
کاپشن مردانه برند کیگیلی اصل 469666,,0
کاپشن مردانه برند پوما اصل 58770601,,0
کاپشن مردانه برند کیگیلی اصل 524685,,0
کاپشن مردانه اسلازنگر ا slazenger | ST22JE014 3804496,slazenger | ST22JE014 3804496,0
کاپشن مردانه کوتون اورجینال | 3WAM20296HW,,0
پالتو مردانه پشمی چهارخانه,,0
کاپشن دو روی پاییزه زمستانه مردانه رنگ مشکی آبی فیروزه ای کد 1656,,0
کاپشن گرم زمستانه مشکی مردانه کلاه دار و داخل خز کد1590,,0
کاپشن چرمی,,0
کاپشن موتور سواری مردانه Harley Davidson TXCEA328C215522,,0
کاپشن پر مردانه JEKELANWANG,,0
کاپشن دوپوش Jido Wanzifs (CAIER),,0
کاپشن مردانه برند لوفیان اصل TYCB1CXERN169398790794145,,0
کاپشن مردانه جک اند جونز اورجینال | 12234775,,0
کاپشن اسپرت مردانه والیانت استایل مدل مموری رنگ سرمه‌ ای,,0
بارانی و بادگیر مردانه برند جک اند جونز اصل 12238915,,0
پالتو مردانه مدل مخمل جودون یقه بلیزر رنگ سرمه ای وستی شاپ مدل 300546,,0
کاپشن مردانه کینتیکس اورجینال | ML ECHO COAT 3PR,,0
بادگیر مردانه ZHIVA مدل 2782,,0
کاپشن دو روی پاییزه زمستانه مردانه رنگ زیتونی طوسی کد 1611,,0
کاپشن مردانه کوتون اورجینال | TYCYIPFOFN170068800943818,,0
کاپشن مردانه برند جک اند جونز اصل 12238906,,0
کاپشن مردانه برند جک اند جونز اصل 4KEMNBS35273,,0
اورکت امریکایی,,0
کاپشن مردانه Fila مدل Silva,,0
کاپشن هیتردار شارژی میلواکی بدون باتری مدل M12 HJ GREY5-0,,0
کاپشن دوپوش اور کد C0080,,0
کاپشن دیرهانتر مردانه - Deerhunter 2130.5746.365.54,,0
بادگیر مردانه شمعی آستر دار (ضد آب),,0
کاپشن مردانه دفاکتو اورجینال | R0216AZ23AU,,0
کاپشن مردانه لافت اورجینال | 153,,0
